  0.000000 173.194.45.70 -> 10.8.108.4   TCP https > 51072 [ACK] Seq=1 Ack=1 Win=1002 Len=0 SLE=4294965844 SRE=4294967274
  0.005646   10.8.108.4 -> 173.194.45.70 TCP 51072 > https [ACK] Seq=4294967274 Ack=4294958291 Win=16384 Len=0 SLE=4294958205 SRE=4294958291
  0.009364   10.8.108.4 -> 173.194.45.81 TCP 51131 > https [ACK] Seq=1 Ack=1 Win=16445 Len=0
  0.009368   10.8.108.4 -> 173.194.45.81 TCP 51125 > https [ACK] Seq=1 Ack=1 Win=16445 Len=0
  0.009371   10.8.108.4 -> 173.194.45.79 TCP 51031 > https [ACK] Seq=1 Ack=1 Win=16445 Len=0
  0.009375   10.8.108.4 -> 173.194.45.79 TCP 51031 > https [ACK] Seq=1 Ack=6139 Win=15778 Len=0
  0.009377   10.8.108.4 -> 173.194.45.79 TCP 51031 > https [ACK] Seq=1 Ack=14719 Win=13633 Len=0
  0.009395   10.8.108.4 -> 173.194.45.84 TCP 51133 > https [ACK] Seq=1 Ack=1 Win=16445 Len=0
  0.009399   10.8.108.4 -> 173.194.45.79 TCP 51031 > https [ACK] Seq=1 Ack=19009 Win=12561 Len=0
  0.009453   10.8.108.4 -> 173.194.45.81 TLSv1 Client Key Exchange, Change Cipher Spec, Encrypted Handshake Message
  0.009457   10.8.108.4 -> 173.194.45.79 TCP [TCP Window Update] 51031 > https [ACK] Seq=1 Ack=19009 Win=13429 Len=0
  0.009459   10.8.108.4 -> 173.194.45.79 TCP [TCP Window Update] 51031 > https [ACK] Seq=1 Ack=19009 Win=16445 Len=0
  0.009462   10.8.108.4 -> 173.194.45.84 TLSv1 Application Data
  0.010874 10.8.108.131 -> 93.184.222.220 TCP 53895 > http [ACK] Seq=1 Ack=1 Win=2617 Len=0
  0.010879 10.8.108.131 -> 93.184.222.220 TCP 53895 > http [ACK] Seq=1 Ack=2921 Win=2617 Len=0
  0.012372   10.8.108.4 -> 173.194.45.84 TLSv1 Encrypted Alert
  0.012376   10.8.108.4 -> 173.194.45.84 TCP 51133 > https [FIN, ACK] Seq=69 Ack=1 Win=16445 Len=0
  0.012379   10.8.108.4 -> 173.194.45.84 TCP 51134 > https [SYN] Seq=0 Win=8192 Len=0 MSS=1460 WS=2
  0.012698 184.75.174.125 -> 10.8.97.161  TCP 9339 > 50339 [ACK] Seq=1 Ack=1 Win=249 Len=0
  0.013809  10.8.102.28 -> 10.8.111.255 UDP Source port: 17500  Destination port: 17500
  0.016139 20:10:7a:f9:8d:d6 -> HewlettP_3f:f2:82 ARP Who has 10.8.97.1?  Tell 10.8.108.64
  0.016196 HewlettP_3f:f2:82 -> 20:10:7a:f9:8d:d6 ARP 10.8.97.1 is at 00:08:02:3f:f2:82
  0.018058   10.8.99.62 -> 195.59.44.34 TCP gandalf-lm > https [ACK] Seq=1 Ack=1 Win=68 Len=0
  0.020178 108.162.198.194 -> 10.8.110.157 HTTP Continuation or non-HTTP traffic
  0.023418 173.194.45.79 -> 10.8.108.4   SSL Continuation Data
  0.024320 173.194.45.79 -> 10.8.108.4   SSL Continuation Data
  0.025561 173.194.45.79 -> 10.8.108.4   SSL Continuation Data
  0.025702 10.8.110.157 -> 108.162.198.194 TCP 49465 > http [ACK] Seq=1 Ack=1 Win=65340 Len=0 SLE=1461 SRE=7301
  0.027364 173.194.45.84 -> 10.8.108.4   TCP https > 51132 [ACK] Seq=1 Ack=1 Win=1002 Len=0 SLE=4294967139 SRE=1
  0.028017 10.8.110.157 -> 108.162.198.194 TCP [TCP Dup ACK 28#1] 49465 > http [ACK] Seq=1 Ack=1 Win=65340 Len=0 SLE=1461 SRE=8761
  0.029177 10.8.110.157 -> 108.162.198.194 TCP [TCP Dup ACK 28#2] 49465 > http [ACK] Seq=1 Ack=1 Win=65340 Len=0 SLE=1461 SRE=10221
  0.029576 173.194.45.70 -> 10.8.108.4   TCP [TCP Dup ACK 1#1] [TCP ACKed lost segment] https > 51072 [ACK] Seq=1 Ack=1 Win=1002 Len=0
  0.031234  10.8.97.161 -> 108.160.162.112 HTTP GET /subscribe?host_int=601086657&ns_map=252184194_30316955266,252165365_14680450383093&user_id=157369133&nid=0&ts=1371025120 HTTP/1.1 
  0.033742 173.194.45.84 -> 10.8.108.4   TCP https > 51133 [ACK] Seq=1 Ack=42 Win=1002 Len=0
  0.037154 93.184.222.220 -> 10.8.108.131 HTTP Continuation or non-HTTP traffic
  0.037699  10.8.109.76 -> 239.255.255.250 SSDP M-SEARCH * HTTP/1.1 
  0.038096 93.184.222.220 -> 10.8.108.131 HTTP Continuation or non-HTTP traffic
  0.038595 93.184.222.220 -> 10.8.108.131 HTTP Continuation or non-HTTP traffic
  0.038870 93.184.222.220 -> 10.8.108.131 HTTP Continuation or non-HTTP traffic
  0.039137 173.194.45.84 -> 10.8.108.4   TCP https > 51133 [ACK] Seq=1 Ack=69 Win=1002 Len=0
  0.039395 173.194.45.84 -> 10.8.108.4   TCP https > 51133 [FIN, ACK] Seq=1 Ack=69 Win=1002 Len=0
  0.039439 173.194.45.84 -> 10.8.108.4   TCP https > 51133 [ACK] Seq=2 Ack=70 Win=1002 Len=0
  0.043852 173.194.45.79 -> 10.8.108.4   SSL Continuation Data
  0.044490   10.8.108.4 -> 173.194.45.79 TCP 51031 > https [ACK] Seq=1 Ack=22481 Win=16445 Len=0
  0.044494   10.8.108.4 -> 173.194.45.84 TCP 51132 > https [ACK] Seq=1 Ack=1 Win=16375 Len=0
  0.044497   10.8.108.4 -> 173.194.45.79 TCP 51031 > https [ACK] Seq=1 Ack=25953 Win=16445 Len=0
  0.044500   10.8.108.4 -> 173.194.45.79 TCP 51031 > https [ACK] Seq=1 Ack=27589 Win=16445 Len=0
  0.044809 173.194.45.79 -> 10.8.108.4   SSL Continuation Data
  0.046434 173.194.45.79 -> 10.8.108.4   SSL Continuation Data
  0.046774 173.194.45.79 -> 10.8.108.4   SSL Continuation Data
  0.046780   10.8.99.62 -> 195.59.44.34 TCP gandalf-lm > https [ACK] Seq=1 Ack=2905 Win=222 Len=0
  0.047173   10.8.108.4 -> 173.194.45.70 TCP 51072 > https [ACK] Seq=1 Ack=4294961206 Win=16445 Len=0
  0.047849 173.194.45.79 -> 10.8.108.4   SSL Continuation Data
  0.048600 173.194.45.79 -> 10.8.108.4   SSL Continuation Data
  0.048811 10.8.110.106 -> 98.221.106.80 TCP 55187 > 35248 [PSH, ACK] Seq=1 Ack=1 Win=59 Len=20
  0.049674 173.194.45.79 -> 10.8.108.4   SSL Continuation Data
  0.050449 173.194.45.79 -> 10.8.108.4   SSL Continuation Data
  0.050454  10.8.105.34 -> 173.194.5.234 TCP 50767 > http [ACK] Seq=1 Ack=1 Win=65081 Len=0 SLE=4381 SRE=40881
  0.050917  10.8.103.72 -> 95.211.213.99 TCP 50333 > http [ACK] Seq=1 Ack=1 Win=65522 Len=0 TSV=149560 TSER=2670194188
  0.050921  10.8.103.72 -> 95.211.213.99 TCP 50333 > http [ACK] Seq=1 Ack=2897 Win=65522 Len=0 TSV=149560 TSER=2670194188
  0.050924  10.8.103.72 -> 95.211.213.99 TCP 50333 > http [ACK] Seq=1 Ack=5793 Win=65522 Len=0 TSV=149560 TSER=2670194202
  0.050927  10.8.103.72 -> 95.211.213.99 TCP 50333 > http [ACK] Seq=1 Ack=8689 Win=65230 Len=0 TSV=149560 TSER=2670194202
  0.050930  10.8.103.72 -> 95.211.213.99 TCP 50333 > http [ACK] Seq=1 Ack=11585 Win=64506 Len=0 TSV=149560 TSER=2670194203
  0.050994 10.8.110.106 -> 75.157.163.66 TCP 55235 > 16247 [PSH, ACK] Seq=1 Ack=1 Win=63 Len=26
  0.051157   10.8.99.62 -> 173.194.45.65 TCP dvl-activemail > https [ACK] Seq=1 Ack=1 Win=67 Len=0
  0.051184  10.8.105.34 -> 173.194.5.234 TCP [TCP Dup ACK 58#1] 50767 > http [ACK] Seq=1 Ack=1 Win=65081 Len=0 SLE=4381 SRE=42341
  0.051413 173.194.45.79 -> 10.8.108.4   SSL Continuation Data
  0.052215 173.194.45.79 -> 10.8.108.4   SSL Continuation Data
  0.053055  10.8.103.72 -> 95.211.213.99 TCP [TCP Window Update] 50333 > http [ACK] Seq=1 Ack=11585 Win=65374 Len=0 TSV=149560 TSER=2670194203
  0.053641 173.194.45.79 -> 10.8.108.4   SSL Continuation Data
  0.053777 108.162.198.194 -> 10.8.110.157 HTTP [TCP Previous segment lost] Continuation or non-HTTP traffic
  0.054372 173.194.45.79 -> 10.8.108.4   SSL Continuation Data
  0.055141 173.194.45.79 -> 10.8.108.4   SSL Continuation Data
  0.055336 10.8.110.106 -> 208.111.16.198 TCP 55170 > 43781 [ACK] Seq=1 Ack=1 Win=64 Len=0
  0.055604 108.162.198.194 -> 10.8.110.157 HTTP Continuation or non-HTTP traffic
  0.056470 173.194.45.79 -> 10.8.108.4   SSL Continuation Data
  0.057145 173.194.45.79 -> 10.8.108.4   SSL Continuation Data
  0.057150 173.194.45.81 -> 10.8.108.4   TCP https > 51131 [ACK] Seq=1 Ack=159 Win=1002 Len=0
  0.057228 173.194.45.81 -> 10.8.108.4   TLSv1 Encrypted Handshake Message, Change Cipher Spec, Encrypted Handshake Message
  0.057336 173.194.45.81 -> 10.8.108.4   TLSv1 Application Data
  0.058583 173.194.45.79 -> 10.8.108.4   SSL Continuation Data
  0.059547 173.194.45.79 -> 10.8.108.4   SSL Continuation Data
  0.060162  10.8.103.78 -> 173.194.40.180 TCP 58666 > https [ACK] Seq=1 Ack=1 Win=64 Len=0 SLE=4294967260 SRE=1
  0.060598 173.194.45.79 -> 10.8.108.4   SSL Continuation Data
  0.060604 173.194.45.84 -> 10.8.108.4   TCP https > 51134 [SYN, ACK] Seq=0 Ack=1 Win=62920 Len=0 MSS=1430 WS=6
  0.060676 173.194.45.84 -> 10.8.108.4   TLSv1 [TCP Retransmission] Encrypted Handshake Message, Change Cipher Spec, Encrypted Handshake Message
  0.061773 195.59.44.34 -> 10.8.99.62   SSL Continuation Data
  0.061807   10.8.108.4 -> 173.194.45.81 TCP [TCP Dup ACK 10#1] 51131 > https [ACK] Seq=159 Ack=1 Win=16445 Len=0 SLE=4294966228 SRE=1
  0.061811   10.8.108.4 -> 173.194.45.84 TCP [TCP Dup ACK 17#1] 51133 > https [ACK] Seq=70 Ack=1 Win=16445 Len=0 SLE=4294967009 SRE=1
  0.061814   10.8.108.4 -> 173.194.45.70 TCP 51072 > https [ACK] Seq=1 Ack=1 Win=16445 Len=0 SLE=4294966240 SRE=1
  0.061817   10.8.108.4 -> 173.194.45.84 TCP [TCP ZeroWindow] 51128 > https [ACK] Seq=1 Ack=1 Win=0 Len=0
  0.061826   10.8.108.4 -> 173.194.45.84 TCP [TCP Dup ACK 45#1] 51132 > https [ACK] Seq=1 Ack=1 Win=16375 Len=0 SLE=4294967244 SRE=1
  0.061850   10.8.108.4 -> 173.194.45.84 TCP [TCP Dup ACK 17#2] 51133 > https [ACK] Seq=70 Ack=1 Win=16445 Len=0 SLE=4294965320 SRE=4294965373
  0.061853   10.8.108.4 -> 173.194.45.81 TCP [TCP Dup ACK 4#1] 51125 > https [ACK] Seq=1 Ack=1 Win=16445 Len=0 SLE=4294966398 SRE=1
  0.061855   10.8.108.4 -> 173.194.45.70 TCP [TCP Dup ACK 90#1] 51072 > https [ACK] Seq=1 Ack=1 Win=16445 Len=0 SLE=4294958291 SRE=4294958346
  0.066570 10.8.110.106 -> 208.111.16.198 TCP 55170 > 43781 [PSH, ACK] Seq=1 Ack=1 Win=64 Len=29
  0.070688  10.8.99.198 -> 239.255.255.250 SSDP M-SEARCH * HTTP/1.1 
  0.072084 173.194.45.70 -> 10.8.108.4   TLSv1 [TCP Retransmission] Application Data
  0.072357 10.8.108.131 -> 93.184.222.220 TCP 53895 > http [ACK] Seq=1 Ack=5841 Win=2606 Len=0
  0.072362 10.8.108.131 -> 93.184.222.220 TCP 53895 > http [ACK] Seq=1 Ack=8045 Win=2597 Len=0
  0.072603 173.194.45.70 -> 10.8.108.4   TLSv1 [TCP Retransmission] Application Data
  0.072803   10.8.108.4 -> 173.194.45.84 TLSv1 Application Data
  0.072930   10.8.108.4 -> 173.194.45.84 TLSv1 Application Data
  0.072998   10.8.108.4 -> 173.194.45.84 TLSv1 Application Data
  0.073055   10.8.108.4 -> 173.194.45.84 TLSv1 Application Data
  0.073786   10.8.99.65 -> 10.8.111.255 NBNS Name query NB ADM-P<1c>
  0.075483  10.8.105.34 -> 173.194.5.234 TCP [TCP Dup ACK 58#2] 50767 > http [ACK] Seq=1 Ack=1 Win=65081 Len=0 SLE=4381 SRE=43801
  0.075487  10.8.105.34 -> 173.194.5.234 TCP [TCP Dup ACK 58#3] 50767 > http [ACK] Seq=1 Ack=1 Win=65081 Len=0 SLE=4381 SRE=45261
  0.075490  10.8.105.34 -> 173.194.5.234 TCP [TCP Dup ACK 58#4] 50767 > http [ACK] Seq=1 Ack=1 Win=65081 Len=0 SLE=4381 SRE=46721
  0.075493  10.8.105.34 -> 173.194.5.234 TCP [TCP Dup ACK 58#5] 50767 > http [ACK] Seq=1 Ack=1 Win=65081 Len=0 SLE=4381 SRE=48181
  0.077093 173.194.45.79 -> 10.8.108.4   SSL Continuation Data
  0.078110 173.194.45.79 -> 10.8.108.4   SSL Continuation Data
  0.078358 173.194.45.79 -> 10.8.108.4   SSL Continuation Data
  0.086722 GemtekTe_cd:4c:d8 -> Broadcast    ARP Who has 10.8.96.30?  Tell 10.8.107.7
  0.088719 195.59.44.34 -> 10.8.99.62   SSL Continuation Data
  0.088888 95.211.213.99 -> 10.8.103.72  HTTP Continuation or non-HTTP traffic
  0.089011 195.59.44.34 -> 10.8.99.62   SSL Continuation Data
  0.089126 GemtekTe_cd:4c:d8 -> Broadcast    ARP Who has 10.8.96.31?  Tell 10.8.107.7
  0.089350 95.211.213.99 -> 10.8.103.72  HTTP Continuation or non-HTTP traffic
  0.089598 195.59.44.34 -> 10.8.99.62   SSL Continuation Data
  0.090330 95.211.213.99 -> 10.8.103.72  HTTP Continuation or non-HTTP traffic
  0.091074 95.211.213.99 -> 10.8.103.72  HTTP Continuation or non-HTTP traffic
  0.091572 95.211.213.99 -> 10.8.103.72  HTTP Continuation or non-HTTP traffic
  0.092556 95.211.213.99 -> 10.8.103.72  HTTP Continuation or non-HTTP traffic
  0.093543 95.211.213.99 -> 10.8.103.72  HTTP Continuation or non-HTTP traffic
  0.094037 95.211.213.99 -> 10.8.103.72  HTTP Continuation or non-HTTP traffic
  0.095017 95.211.213.99 -> 10.8.103.72  HTTP Continuation or non-HTTP traffic
  0.095761 95.211.213.99 -> 10.8.103.72  HTTP Continuation or non-HTTP traffic
  0.096730 173.194.5.234 -> 10.8.105.34  HTTP Continuation or non-HTTP traffic
  0.097251 95.211.213.99 -> 10.8.103.72  HTTP Continuation or non-HTTP traffic
  0.097889   10.8.108.4 -> 173.194.45.79 TCP 51031 > https [ACK] Seq=1 Ack=32897 Win=16445 Len=0
  0.097894   10.8.108.4 -> 173.194.45.79 TCP 51031 > https [ACK] Seq=1 Ack=34703 Win=16445 Len=0
  0.098098 GemtekTe_cd:4c:d8 -> Broadcast    ARP Who has 10.8.96.32?  Tell 10.8.107.7
  0.098262 95.211.213.99 -> 10.8.103.72  HTTP Continuation or non-HTTP traffic
  0.099042 10.8.110.106 -> 96.242.32.9  TCP 55231 > 49052 [ACK] Seq=1 Ack=1 Win=62 Len=0
  0.099206 95.211.213.99 -> 10.8.103.72  HTTP Continuation or non-HTTP traffic
  0.099702 95.211.213.99 -> 10.8.103.72  HTTP Continuation or non-HTTP traffic
  0.099855 10.8.110.106 -> 208.111.16.198 TCP 55170 > 43781 [ACK] Seq=30 Ack=21 Win=64 Len=0
  0.100443 95.211.213.99 -> 10.8.103.72  HTTP Continuation or non-HTTP traffic
  0.101420 95.211.213.99 -> 10.8.103.72  HTTP Continuation or non-HTTP traffic
  0.102004 GemtekTe_cd:4c:d8 -> Broadcast    ARP Who has 10.8.96.33?  Tell 10.8.107.7
  0.102408 95.211.213.99 -> 10.8.103.72  HTTP Continuation or non-HTTP traffic
  0.102909 95.211.213.99 -> 10.8.103.72  HTTP Continuation or non-HTTP traffic
  0.103038 173.194.45.84 -> 10.8.108.4   TCP https > 51132 [ACK] Seq=1 Ack=54 Win=1002 Len=0
  0.103330  10.8.105.34 -> 173.194.5.234 TCP [TCP Dup ACK 58#6] 50767 > http [ACK] Seq=1 Ack=1 Win=65081 Len=0 SLE=4381 SRE=49641
  0.103663 10.8.110.157 -> 108.162.198.194 TCP 49465 > http [ACK] Seq=1 Ack=11681 Win=65340 Len=0
  0.103894 GemtekTe_cd:4c:d8 -> Broadcast    ARP Who has 10.8.96.34?  Tell 10.8.107.7
  0.103900  10.8.105.34 -> 173.194.5.234 TCP [TCP Dup ACK 58#7] 50767 > http [ACK] Seq=1 Ack=1 Win=65081 Len=0 SLE=4381 SRE=51101
  0.103903 95.211.213.99 -> 10.8.103.72  HTTP Continuation or non-HTTP traffic
  0.105633  10.8.105.34 -> 173.194.5.234 TCP [TCP Dup ACK 58#8] 50767 > http [ACK] Seq=1 Ack=1 Win=65081 Len=0 SLE=4381 SRE=52561
  0.105637  10.8.105.34 -> 173.194.5.234 TCP [TCP Dup ACK 58#9] 50767 > http [ACK] Seq=1 Ack=1 Win=65081 Len=0 SLE=4381 SRE=54021
  0.105640  10.8.105.34 -> 173.194.5.234 TCP [TCP Dup ACK 58#10] 50767 > http [ACK] Seq=1 Ack=1 Win=65081 Len=0 SLE=4381 SRE=55481
  0.105643  10.8.105.34 -> 173.194.5.234 TCP [TCP Dup ACK 58#11] 50767 > http [ACK] Seq=1 Ack=1 Win=65081 Len=0 SLE=4381 SRE=56941
  0.105646  10.8.105.34 -> 173.194.5.234 TCP [TCP Dup ACK 58#12] 50767 > http [ACK] Seq=1 Ack=1 Win=65081 Len=0 SLE=4381 SRE=58401
  0.105675  10.8.105.34 -> 173.194.5.234 TCP [TCP Dup ACK 58#13] 50767 > http [ACK] Seq=1 Ack=1 Win=65081 Len=0 SLE=4381 SRE=59861
  0.105680  10.8.105.34 -> 173.194.5.234 TCP [TCP Dup ACK 58#14] 50767 > http [ACK] Seq=1 Ack=1 Win=65081 Len=0 SLE=4381 SRE=61321
  0.105683  10.8.105.34 -> 173.194.5.234 TCP [TCP Dup ACK 58#15] 50767 > http [ACK] Seq=1 Ack=1 Win=65081 Len=0 SLE=4381 SRE=62781
  0.105686  10.8.105.34 -> 173.194.5.234 TCP [TCP Dup ACK 58#16] 50767 > http [ACK] Seq=1 Ack=1 Win=65081 Len=0 SLE=4381 SRE=64241
  0.105688  10.8.105.34 -> 173.194.5.234 TCP [TCP Dup ACK 58#17] 50767 > http [ACK] Seq=1 Ack=1 Win=65081 Len=0 SLE=4381 SRE=65701
  0.105710  10.8.105.34 -> 173.194.5.234 TCP [TCP Dup ACK 58#18] 50767 > http [ACK] Seq=1 Ack=1 Win=65081 Len=0 SLE=4381 SRE=67161
  0.105713  10.8.105.34 -> 173.194.5.234 TCP [TCP Dup ACK 58#19] 50767 > http [ACK] Seq=1 Ack=1 Win=65081 Len=0 SLE=4381 SRE=68621
  0.105716  10.8.105.34 -> 173.194.5.234 TCP [TCP Dup ACK 58#20] 50767 > http [ACK] Seq=1 Ack=1 Win=65081 Len=0 SLE=4381 SRE=70081
  0.105718  10.8.105.34 -> 173.194.5.234 TCP [TCP Dup ACK 58#21] 50767 > http [ACK] Seq=1 Ack=1 Win=65081 Len=0 SLE=4381 SRE=71541
  0.105720  10.8.105.34 -> 173.194.5.234 TCP [TCP Dup ACK 58#22] 50767 > http [ACK] Seq=1 Ack=1 Win=65081 Len=0 SLE=4381 SRE=73001
  0.105747  10.8.105.34 -> 173.194.5.234 TCP [TCP Dup ACK 58#23] 50767 > http [ACK] Seq=1 Ack=1 Win=65081 Len=0 SLE=4381 SRE=74461
  0.105749  10.8.105.34 -> 173.194.5.234 TCP [TCP Dup ACK 58#24] 50767 > http [ACK] Seq=1 Ack=1 Win=65081 Len=0 SLE=4381 SRE=75921
  0.105753  10.8.105.34 -> 173.194.5.234 TCP [TCP Dup ACK 58#25] 50767 > http [ACK] Seq=1 Ack=1 Win=65081 Len=0 SLE=4381 SRE=77381
  0.105755  10.8.105.34 -> 173.194.5.234 TCP [TCP Dup ACK 58#26] 50767 > http [ACK] Seq=1 Ack=1 Win=65081 Len=0 SLE=4381 SRE=78841
  0.105757  10.8.105.34 -> 173.194.5.234 TCP [TCP Dup ACK 58#27] 50767 > http [ACK] Seq=1 Ack=1 Win=65081 Len=0 SLE=4381 SRE=80301
  0.105782  10.8.105.34 -> 173.194.5.234 TCP [TCP Dup ACK 58#28] 50767 > http [ACK] Seq=1 Ack=1 Win=65081 Len=0 SLE=4381 SRE=81761
  0.105786  10.8.105.34 -> 173.194.5.234 TCP [TCP Dup ACK 58#29] 50767 > http [ACK] Seq=1 Ack=1 Win=65081 Len=0 SLE=4381 SRE=83221
  0.105788  10.8.105.34 -> 173.194.5.234 TCP 50767 > http [ACK] Seq=1 Ack=1461 Win=65340 Len=0 SLE=4381 SRE=83221
  0.105790  10.8.105.34 -> 173.194.5.234 TCP 50767 > http [ACK] Seq=1 Ack=2921 Win=65340 Len=0 SLE=4381 SRE=83221
  0.105793  10.8.105.34 -> 173.194.5.234 TCP 50767 > http [ACK] Seq=1 Ack=83221 Win=65340 Len=0
  0.105823  10.8.105.34 -> 173.194.5.234 TCP 50767 > http [ACK] Seq=1 Ack=86141 Win=64610 Len=0
  0.105826  10.8.105.34 -> 173.194.5.234 TCP 50767 > http [ACK] Seq=1 Ack=89061 Win=63880 Len=0
  0.105829  10.8.105.34 -> 173.194.5.234 TCP 50767 > http [ACK] Seq=1 Ack=91981 Win=63150 Len=0
  0.106685 GemtekTe_cd:4c:d8 -> Broadcast    ARP Who has 10.8.96.35?  Tell 10.8.107.7
  0.106937 173.194.45.84 -> 10.8.108.4   TCP https > 51132 [ACK] Seq=1 Ack=548 Win=1002 Len=0
  0.107509 173.194.45.84 -> 10.8.108.4   TLSv1 Application Data
  0.108848 173.194.45.84 -> 10.8.108.4   TLSv1 Application Data
  0.109369  10.8.105.34 -> 173.194.5.234 TCP 50767 > http [ACK] Seq=1 Ack=93441 Win=65340 Len=0
  0.109374 173.194.5.234 -> 10.8.105.34  HTTP Continuation or non-HTTP traffic
  0.109507 173.194.45.84 -> 10.8.108.4   TLSv1 Application Data
  0.111764 GemtekTe_cd:4c:d8 -> Broadcast    ARP Who has 10.8.96.36?  Tell 10.8.107.7
  0.112159 173.194.45.84 -> 10.8.108.4   TLSv1 Application Data
  0.112164 173.194.5.234 -> 10.8.105.34  HTTP Continuation or non-HTTP traffic
  0.112371 GemtekTe_cd:4c:d8 -> Broadcast    ARP Who has 10.8.96.37?  Tell 10.8.107.7
  0.112796 GemtekTe_cd:4c:d8 -> Broadcast    ARP Who has 10.8.96.38?  Tell 10.8.107.7
  0.113144 GemtekTe_cd:4c:d8 -> Broadcast    ARP Who has 10.8.96.39?  Tell 10.8.107.7
  0.113150 173.194.5.234 -> 10.8.105.34  HTTP Continuation or non-HTTP traffic
  0.113361 173.194.45.84 -> 10.8.108.4   TLSv1 Application Data
  0.113831 173.194.45.84 -> 10.8.108.4   TLSv1 Application Data
  0.114002   10.8.97.76 -> 239.255.255.250 SSDP NOTIFY * HTTP/1.1 
  0.114137 fe80::65cb:5cb4:638c:9309 -> ff02::c      SSDP NOTIFY * HTTP/1.1 
  0.116325 173.194.45.84 -> 10.8.108.4   TLSv1 Application Data
  0.117468 173.194.45.84 -> 10.8.108.4   TLSv1 Application Data
  0.117472 GemtekTe_cd:4c:d8 -> Broadcast    ARP Who has 10.8.96.40?  Tell 10.8.107.7
  0.117780 173.194.45.84 -> 10.8.108.4   TLSv1 Application Data
  0.118444 fe80::a8fa:8007:1d5:4411 -> ff02::1:3    LLMNR Standard query A voltaire
  0.118777  10.8.103.72 -> 95.211.213.99 TCP 50333 > http [ACK] Seq=1 Ack=14481 Win=64650 Len=0 TSV=149560 TSER=2670194203
  0.118781  10.8.103.72 -> 95.211.213.99 TCP 50333 > http [ACK] Seq=1 Ack=17377 Win=63926 Len=0 TSV=149560 TSER=2670194203
  0.118784  10.8.103.72 -> 95.211.213.99 TCP 50333 > http [ACK] Seq=1 Ack=20273 Win=63202 Len=0 TSV=149560 TSER=2670194203
  0.118787  10.8.103.72 -> 95.211.213.99 TCP 50333 > http [ACK] Seq=1 Ack=23169 Win=63346 Len=0 TSV=149560 TSER=2670194203
  0.119931 10.8.100.154 -> 224.0.0.252  LLMNR Standard query A voltaire
  0.119937  10.8.97.103 -> 157.56.254.246 TCP 53344 > https [ACK] Seq=1 Ack=1 Win=65335 Len=0
  0.121357  10.8.103.72 -> 95.211.213.99 TCP [TCP Window Update] 50333 > http [ACK] Seq=1 Ack=23169 Win=65160 Len=0 TSV=149560 TSER=2670194203
  0.121361   10.8.108.4 -> 72.233.111.159 TCP 50954 > http [FIN, ACK] Seq=1 Ack=1 Win=16425 Len=0
  0.121364  10.8.103.72 -> 95.211.213.99 TCP [TCP Window Update] 50333 > http [ACK] Seq=1 Ack=23169 Win=65522 Len=0 TSV=149560 TSER=2670194203
  0.121366  10.8.97.103 -> 157.56.254.246 TCP 53344 > https [ACK] Seq=1 Ack=2646 Win=65335 Len=0
  0.123675  10.8.97.103 -> 157.56.254.246 TCP 53344 > https [ACK] Seq=1 Ack=5566 Win=65335 Len=0
  0.124950  10.8.97.103 -> 157.56.254.246 TCP 53344 > https [ACK] Seq=1 Ack=8211 Win=65335 Len=0
  0.125824  10.8.97.103 -> 157.56.254.246 TCP 53344 > https [ACK] Seq=1 Ack=10856 Win=65335 Len=0
  0.128100  10.8.97.103 -> 157.56.254.246 TCP 53344 > https [ACK] Seq=1 Ack=13776 Win=65335 Len=0
  0.129249 108.162.198.194 -> 10.8.110.157 HTTP Continuation or non-HTTP traffic
  0.129587 173.194.45.79 -> 10.8.108.4   SSL Continuation Data
  0.130004 108.162.198.194 -> 10.8.110.157 HTTP Continuation or non-HTTP traffic
  0.130508 173.194.45.79 -> 10.8.108.4   SSL Continuation Data
  0.131316 173.194.45.79 -> 10.8.108.4   SSL Continuation Data
  0.131321  10.8.97.103 -> 157.56.254.246 TLSv1 Application Data
  0.132252  10.8.97.103 -> 10.8.111.255 NBNS Name query NB PROXY2.ESIEA.FR<00>
  0.132258  10.8.97.103 -> 157.56.254.246 TCP 53344 > https [ACK] Seq=1 Ack=14961 Win=65038 Len=0
  0.132261  10.8.97.103 -> 157.56.254.246 TLSv1 [TCP Out-Of-Order] Application Data
  0.132465 173.194.45.79 -> 10.8.108.4   SSL Continuation Data
  0.133491 173.194.45.79 -> 10.8.108.4   SSL Continuation Data
  0.134229 173.194.45.79 -> 10.8.108.4   SSL Continuation Data
  0.139150 173.194.5.234 -> 10.8.105.34  HTTP Continuation or non-HTTP traffic
  0.140112 173.194.5.234 -> 10.8.105.34  HTTP Continuation or non-HTTP traffic
  0.142331 173.194.5.234 -> 10.8.105.34  HTTP Continuation or non-HTTP traffic
  0.143305 173.194.5.234 -> 10.8.105.34  HTTP Continuation or non-HTTP traffic
  0.144300 173.194.5.234 -> 10.8.105.34  HTTP Continuation or non-HTTP traffic
  0.145275 173.194.5.234 -> 10.8.105.34  HTTP Continuation or non-HTTP traffic
  0.146263 93.184.222.220 -> 10.8.108.131 HTTP Continuation or non-HTTP traffic
  0.147175 93.184.222.220 -> 10.8.108.131 HTTP Continuation or non-HTTP traffic
  0.147989 93.184.222.220 -> 10.8.108.131 HTTP Continuation or non-HTTP traffic
  0.148477 93.184.222.220 -> 10.8.108.131 HTTP Continuation or non-HTTP traffic
  0.149491 173.194.5.234 -> 10.8.105.34  HTTP Continuation or non-HTTP traffic
  0.149833   10.8.108.4 -> 173.194.45.79 TCP 51031 > https [ACK] Seq=1 Ack=39841 Win=16445 Len=0
  0.149838   10.8.108.4 -> 173.194.45.79 TCP 51031 > https [ACK] Seq=1 Ack=43313 Win=16445 Len=0
  0.149841   10.8.108.4 -> 173.194.45.79 TCP 51031 > https [ACK] Seq=1 Ack=46785 Win=16445 Len=0
  0.149843   10.8.108.4 -> 173.194.45.79 TCP 51031 > https [ACK] Seq=1 Ack=49003 Win=16445 Len=0
  0.149846   10.8.108.4 -> 173.194.45.79 TCP 51031 > https [ACK] Seq=1 Ack=53729 Win=16445 Len=0
  0.149868   10.8.108.4 -> 173.194.45.81 TCP 51131 > https [ACK] Seq=159 Ack=280 Win=16375 Len=0
  0.149871   10.8.108.4 -> 173.194.45.79 TCP 51031 > https [ACK] Seq=1 Ack=57583 Win=16445 Len=0
  0.149874   10.8.108.4 -> 173.194.45.84 TCP 51134 > https [ACK] Seq=1 Ack=1 Win=65780 Len=0
  0.149879   10.8.108.4 -> 173.194.45.84 TCP [TCP Dup ACK 105#1] 51132 > https [ACK] Seq=1524 Ack=1 Win=16375 Len=0 SLE=4294967018 SRE=4294967244
  0.149881   10.8.108.4 -> 173.194.45.70 TCP [TCP Dup ACK 90#2] 51072 > https [ACK] Seq=1 Ack=1 Win=16445 Len=0 SLE=4294961206 SRE=4294962636
  0.149898   10.8.108.4 -> 173.194.45.70 TCP [TCP Dup ACK 90#3] 51072 > https [ACK] Seq=1 Ack=1 Win=16445 Len=0 SLE=4294962636 SRE=4294964066
  0.149902   10.8.108.4 -> 173.194.45.79 TCP 51031 > https [ACK] Seq=1 Ack=60479 Win=16445 Len=0
  0.150115   10.8.108.4 -> 173.194.45.84 TLSv1 Application Data, Application Data, 
  0.150203   10.8.108.4 -> 173.194.45.84 TLSv1 Application Data, Application Data, 
  0.150208   10.8.108.4 -> 173.194.45.79 TLSv1 Application Data
  0.150457 173.194.5.234 -> 10.8.105.34  HTTP Continuation or non-HTTP traffic
  0.151244 173.194.5.234 -> 10.8.105.34  HTTP Continuation or non-HTTP traffic
  0.151703 173.194.5.234 -> 10.8.105.34  HTTP Continuation or non-HTTP traffic
  0.152670 173.194.5.234 -> 10.8.105.34  HTTP Continuation or non-HTTP traffic
  0.153654 173.194.5.234 -> 10.8.105.34  HTTP Continuation or non-HTTP traffic
  0.154145 173.194.5.234 -> 10.8.105.34  HTTP Continuation or non-HTTP traffic
  0.154766  10.8.103.72 -> 95.211.213.99 TCP 50333 > http [ACK] Seq=1 Ack=26065 Win=65522 Len=0 TSV=149572 TSER=2670194336
  0.154771  10.8.103.72 -> 95.211.213.99 TCP 50333 > http [ACK] Seq=1 Ack=28961 Win=65522 Len=0 TSV=149572 TSER=2670194336
  0.154773  10.8.103.72 -> 95.211.213.99 TCP 50333 > http [ACK] Seq=1 Ack=31857 Win=65522 Len=0 TSV=149572 TSER=2670194336
  0.154776  10.8.103.72 -> 95.211.213.99 TCP 50333 > http [ACK] Seq=1 Ack=34753 Win=64798 Len=0 TSV=149572 TSER=2670194336
  0.154778  10.8.103.72 -> 95.211.213.99 TCP [TCP Window Update] 50333 > http [ACK] Seq=1 Ack=34753 Win=65522 Len=0 TSV=149572 TSER=2670194336
  0.154800  10.8.103.72 -> 95.211.213.99 TCP 50333 > http [ACK] Seq=1 Ack=37649 Win=64798 Len=0 TSV=149572 TSER=2670194336
  0.154805  10.8.103.72 -> 95.211.213.99 TCP 50333 > http [ACK] Seq=1 Ack=40545 Win=64074 Len=0 TSV=149572 TSER=2670194337
  0.154808  10.8.103.72 -> 95.211.213.99 TCP 50333 > http [ACK] Seq=1 Ack=43441 Win=63350 Len=0 TSV=149572 TSER=2670194337
  0.154811  10.8.103.72 -> 95.211.213.99 TCP 50333 > http [ACK] Seq=1 Ack=46337 Win=62626 Len=0 TSV=149572 TSER=2670194337
  0.154813  10.8.103.72 -> 95.211.213.99 TCP [TCP Window Update] 50333 > http [ACK] Seq=1 Ack=46337 Win=63708 Len=0 TSV=149572 TSER=2670194337
  0.154838  10.8.103.72 -> 95.211.213.99 TCP 50333 > http [ACK] Seq=1 Ack=49233 Win=62984 Len=0 TSV=149572 TSER=2670194337
  0.154840  10.8.103.72 -> 95.211.213.99 TCP 50333 > http [ACK] Seq=1 Ack=50681 Win=64436 Len=0 TSV=149573 TSER=2670194337
  0.154843  10.8.103.72 -> 95.211.213.99 TCP [TCP Window Update] 50333 > http [ACK] Seq=1 Ack=50681 Win=65522 Len=0 TSV=149573 TSER=2670194337
  0.155091   10.8.108.4 -> 173.194.45.81 TLSv1 Application Data
  0.155094   10.8.108.4 -> 173.194.45.81 TLSv1 Encrypted Alert
  0.155096   10.8.108.4 -> 173.194.45.81 TCP 51131 > https [FIN, ACK] Seq=255 Ack=280 Win=16375 Len=0
  0.155152   10.8.108.4 -> 173.194.45.84 SSL Client Hello
  0.155347  10.8.105.34 -> 173.194.5.234 TCP 50797 > http [ACK] Seq=1 Ack=1 Win=65340 Len=0
  0.155349 173.194.5.234 -> 10.8.105.34  HTTP Continuation or non-HTTP traffic
  0.155502 10.8.108.146 -> 173.194.45.85 TCP [TCP segment of a reassembled PDU]
  0.155569  10.8.105.34 -> 173.194.5.234 TCP 50797 > http [ACK] Seq=1 Ack=4933 Win=65340 Len=0
  0.156170 173.194.5.234 -> 10.8.105.34  HTTP Continuation or non-HTTP traffic
  0.156669 173.194.5.234 -> 10.8.105.34  HTTP Continuation or non-HTTP traffic
  0.157727 173.194.5.234 -> 10.8.105.34  HTTP Continuation or non-HTTP traffic
  0.158572 173.194.5.234 -> 10.8.105.34  HTTP Continuation or non-HTTP traffic
  0.159573 173.194.5.234 -> 10.8.105.34  HTTP Continuation or non-HTTP traffic
  0.159685  10.8.105.34 -> 173.194.5.234 TCP 50797 > http [ACK] Seq=1 Ack=7301 Win=65340 Len=0
  0.159845 10.8.110.157 -> 108.162.198.194 TCP 49465 > http [ACK] Seq=1 Ack=14601 Win=65340 Len=0
  0.160052 173.194.5.234 -> 10.8.105.34  HTTP Continuation or non-HTTP traffic
  0.160165 98.221.106.80 -> 10.8.110.106 TCP 35248 > 55187 [PSH, ACK] Seq=22 Ack=21 Win=252 Len=28
  0.160416  10.8.105.34 -> 173.194.5.234 TCP 50767 > http [ACK] Seq=1 Ack=99281 Win=65340 Len=0
  0.160420  10.8.105.34 -> 173.194.5.234 TCP 50767 > http [ACK] Seq=1 Ack=102201 Win=65340 Len=0
  0.160423  10.8.105.34 -> 69.171.248.16 TCP 50381 > https [ACK] Seq=1 Ack=1 Win=17386 Len=0 SLE=4294967259 SRE=1
  0.160426  10.8.105.34 -> 173.194.45.69 TCP 50699 > http [ACK] Seq=1 Ack=1 Win=4290 Len=0 SLE=4294966951 SRE=1
  0.160430  10.8.105.34 -> 173.194.5.234 TCP 50797 > http [ACK] Seq=1 Ack=10221 Win=65340 Len=0
  0.160450  10.8.105.34 -> 173.194.5.234 TCP 50767 > http [ACK] Seq=1 Ack=105121 Win=65340 Len=0
  0.160452  10.8.105.34 -> 173.194.5.234 TCP 50767 > http [ACK] Seq=1 Ack=109501 Win=65340 Len=0
  0.164517   10.8.108.4 -> 173.194.45.84 TLSv1 Application Data, Application Data
  0.170583  10.8.105.34 -> 173.194.5.234 TCP 50767 > http [ACK] Seq=1 Ack=115341 Win=65340 Len=0
  0.171697   10.8.108.4 -> 173.194.45.79 TCP 51031 > https [ACK] Seq=42 Ack=64145 Win=16445 Len=0
  0.171700   10.8.108.4 -> 173.194.45.79 TCP 51031 > https [ACK] Seq=42 Ack=69059 Win=16084 Len=0
  0.171703   10.8.108.4 -> 173.194.45.79 TCP [TCP Window Update] 51031 > https [ACK] Seq=42 Ack=69059 Win=16445 Len=0
  0.171964  10.8.96.186 -> 173.194.45.78 TCP 50867 > https [ACK] Seq=1 Ack=1 Win=65535 Len=0 TSV=91431077 TSER=708380698
  0.172809  10.8.105.34 -> 173.194.5.234 TCP 50767 > http [ACK] Seq=1 Ack=129941 Win=65340 Len=0
  0.174403  10.8.96.186 -> 173.194.45.78 TCP 50867 > https [ACK] Seq=1 Ack=1419 Win=65398 Len=0 TSV=91431077 TSER=708380698
  0.177066  10.8.96.186 -> 173.194.45.78 TCP 50867 > https [ACK] Seq=1 Ack=1803 Win=65534 Len=0 TSV=91431077 TSER=708380698
  0.177414  10.8.96.186 -> 173.194.45.78 TLSv1.1 Application Data
  0.178084  10.8.96.186 -> 173.194.45.78 TLSv1.1 Application Data
  0.181606 173.194.45.79 -> 10.8.108.4   TLSv1 Ignored Unknown Record
  0.182490 173.194.45.79 -> 10.8.108.4   TLSv1 Ignored Unknown Record
  0.183518 173.194.45.79 -> 10.8.108.4   TLSv1 Ignored Unknown Record
  0.184443 173.194.45.79 -> 10.8.108.4   TLSv1 Ignored Unknown Record
  0.185450 173.194.45.79 -> 10.8.108.4   TLSv1 Ignored Unknown Record
  0.185573 157.56.254.246 -> 10.8.97.103  TCP [TCP segment of a reassembled PDU]
  0.186251 173.194.45.79 -> 10.8.108.4   TLSv1 Ignored Unknown Record
  0.186415 157.56.254.246 -> 10.8.97.103  TCP [TCP segment of a reassembled PDU]
  0.186827 157.56.254.246 -> 10.8.97.103  TLSv1 Application Data
  0.187187 173.194.45.79 -> 10.8.108.4   TLSv1 Ignored Unknown Record
  0.187890 157.56.254.246 -> 10.8.97.103  TCP [TCP segment of a reassembled PDU]
  0.188633 157.56.254.246 -> 10.8.97.103  TCP [TCP segment of a reassembled PDU]
  0.189025 173.194.45.79 -> 10.8.108.4   TLSv1 Ignored Unknown Record
  0.189129 157.56.254.246 -> 10.8.97.103  TLSv1 Application Data
  0.189288 173.194.45.79 -> 10.8.108.4   TCP [TCP segment of a reassembled PDU]
  0.190141 173.194.45.79 -> 10.8.108.4   TCP [TCP segment of a reassembled PDU]
  0.190354 157.56.254.246 -> 10.8.97.103  TCP [TCP segment of a reassembled PDU]
  0.191093 173.194.45.79 -> 10.8.108.4   TCP [TCP segment of a reassembled PDU]
  0.191336 157.56.254.246 -> 10.8.97.103  TCP [TCP segment of a reassembled PDU]
  0.191742 157.56.254.246 -> 10.8.97.103  TLSv1 Application Data
  0.192100 173.194.45.79 -> 10.8.108.4   TCP [TCP segment of a reassembled PDU]
  0.192815 157.56.254.246 -> 10.8.97.103  TCP [TCP segment of a reassembled PDU]
  0.193082 157.56.254.246 -> 10.8.97.103  TCP [TCP segment of a reassembled PDU]
  0.193197 173.194.45.79 -> 10.8.108.4   TCP [TCP segment of a reassembled PDU]
  0.193890 173.194.45.79 -> 10.8.108.4   TCP [TCP segment of a reassembled PDU]
  0.193985 157.56.254.246 -> 10.8.97.103  TLSv1 Application Data
  0.194030  10.8.105.34 -> 173.194.5.234 TCP 50767 > http [ACK] Seq=1 Ack=138701 Win=65340 Len=0
  0.194557 157.56.254.246 -> 10.8.97.103  TCP [TCP segment of a reassembled PDU]
  0.194664 157.56.254.246 -> 10.8.97.103  TCP https > 53343 [ACK] Seq=1 Ack=82 Win=2455 Len=0
  0.195294 173.194.45.79 -> 10.8.108.4   TCP [TCP segment of a reassembled PDU]
  0.195569 95.211.213.99 -> 10.8.103.72  HTTP Continuation or non-HTTP traffic
  0.196095 173.194.45.79 -> 10.8.108.4   TCP [TCP segment of a reassembled PDU]
  0.196522 95.211.213.99 -> 10.8.103.72  HTTP Continuation or non-HTTP traffic
  0.196597 10.8.108.131 -> 93.184.222.220 TCP 53895 > http [ACK] Seq=1 Ack=10965 Win=2586 Len=0
  0.196600 10.8.108.131 -> 93.184.222.220 TCP 53895 > http [ACK] Seq=1 Ack=13885 Win=2574 Len=0
  0.197032 173.194.45.79 -> 10.8.108.4   TCP [TCP segment of a reassembled PDU]
  0.197654 95.211.213.99 -> 10.8.103.72  HTTP Continuation or non-HTTP traffic
  0.197882 95.211.213.99 -> 10.8.103.72  HTTP Continuation or non-HTTP traffic
  0.198613 173.194.45.79 -> 10.8.108.4   TCP [TCP segment of a reassembled PDU]
  0.198738 95.211.213.99 -> 10.8.103.72  HTTP Continuation or non-HTTP traffic
  0.199022 173.194.45.79 -> 10.8.108.4   TCP [TCP segment of a reassembled PDU]
  0.199720 95.211.213.99 -> 10.8.103.72  HTTP Continuation or non-HTTP traffic
  0.199982 173.194.45.79 -> 10.8.108.4   TCP [TCP segment of a reassembled PDU]
  0.200693 95.211.213.99 -> 10.8.103.72  HTTP Continuation or non-HTTP traffic
  0.200810 173.194.45.79 -> 10.8.108.4   TCP [TCP segment of a reassembled PDU]
  0.201195 95.211.213.99 -> 10.8.103.72  HTTP Continuation or non-HTTP traffic
  0.201967 173.194.45.79 -> 10.8.108.4   TCP [TCP segment of a reassembled PDU]
  0.201972 173.194.45.84 -> 10.8.108.4   TLSv1 Application Data
  0.202260 95.211.213.99 -> 10.8.103.72  HTTP Continuation or non-HTTP traffic
  0.202921 95.211.213.99 -> 10.8.103.72  HTTP Continuation or non-HTTP traffic
  0.203038 173.194.45.84 -> 10.8.108.4   TLSv1 Application Data
  0.203171 173.194.45.84 -> 10.8.108.4   TLSv1 Application Data
  0.203429 173.194.45.84 -> 10.8.108.4   TLSv1 Application Data
  0.203434 95.211.213.99 -> 10.8.103.72  HTTP Continuation or non-HTTP traffic
  0.204169 173.194.45.84 -> 10.8.108.4   TLSv1 Application Data
  0.204413 157.56.254.246 -> 10.8.97.103  TCP [TCP Dup ACK 335#1] https > 53343 [ACK] Seq=1 Ack=82 Win=2455 Len=0
  0.204418 95.211.213.99 -> 10.8.103.72  HTTP Continuation or non-HTTP traffic
  0.204449 173.194.45.84 -> 10.8.108.4   TLSv1 Application Data
  0.204471 173.194.45.84 -> 10.8.108.4   TLSv1 Application Data
  0.205393 95.211.213.99 -> 10.8.103.72  HTTP Continuation or non-HTTP traffic
  0.205510 173.194.45.84 -> 10.8.108.4   TLSv1 Application Data
  0.205645 173.194.45.84 -> 10.8.108.4   TLSv1 Application Data
  0.205700 173.194.45.84 -> 10.8.108.4   TLSv1 Application Data
  0.206359 95.211.213.99 -> 10.8.103.72  HTTP Continuation or non-HTTP traffic
  0.206628 95.211.213.99 -> 10.8.103.72  HTTP Continuation or non-HTTP traffic
  0.207113 173.194.45.84 -> 10.8.108.4   TLSv1 Application Data
  0.207871 95.211.213.99 -> 10.8.103.72  HTTP Continuation or non-HTTP traffic
  0.208023 173.194.45.84 -> 10.8.108.4   TLSv1 Application Data
  0.208028 173.194.45.79 -> 10.8.108.4   TCP https > 51031 [ACK] Seq=100519 Ack=42 Win=1002 Len=0
  0.208520 208.111.16.198 -> 10.8.110.106 TCP 43781 > 55170 [ACK] Seq=68 Ack=4294967250 Win=258 Len=0 SLE=1 SRE=30
  0.208848 173.194.45.81 -> 10.8.108.4   TCP https > 51131 [ACK] Seq=280 Ack=255 Win=1002 Len=0
  0.208852 173.194.45.81 -> 10.8.108.4   TCP https > 51131 [FIN, ACK] Seq=280 Ack=255 Win=1002 Len=0
  0.208856 95.211.213.99 -> 10.8.103.72  HTTP Continuation or non-HTTP traffic
  0.209034 173.194.45.81 -> 10.8.108.4   TCP https > 51131 [ACK] Seq=281 Ack=256 Win=1002 Len=0
  0.209336 95.211.213.99 -> 10.8.103.72  HTTP Continuation or non-HTTP traffic
  0.209550  96.242.32.9 -> 10.8.110.106 TCP 49052 > 55231 [PSH, ACK] Seq=1 Ack=4294967249 Win=65535 Len=137
  0.210318 95.211.213.99 -> 10.8.103.72  HTTP Continuation or non-HTTP traffic
  0.210472 173.194.45.84 -> 10.8.108.4   TCP https > 51134 [ACK] Seq=1 Ack=368 Win=64000 Len=0
  0.210750 173.194.45.84 -> 10.8.108.4   TLSv1 Server Hello, Change Cipher Spec, Encrypted Handshake Message
  0.211299 95.211.213.99 -> 10.8.103.72  HTTP Continuation or non-HTTP traffic
  0.212285 95.211.213.99 -> 10.8.103.72  HTTP Continuation or non-HTTP traffic
  0.212543 108.160.162.112 -> 10.8.97.161  TCP http > 49692 [ACK] Seq=1 Ack=301 Win=83 Len=0
  0.212548 95.211.213.99 -> 10.8.103.72  HTTP Continuation or non-HTTP traffic
  0.213527 95.211.213.99 -> 10.8.103.72  HTTP Continuation or non-HTTP traffic
  0.213781  10.8.103.72 -> 95.211.213.99 TCP 50333 > http [ACK] Seq=1 Ack=53577 Win=65522 Len=0 TSV=149579 TSER=2670194362
  0.214145   10.8.108.4 -> 173.194.45.79 TCP 51031 > https [ACK] Seq=42 Ack=74561 Win=16445 Len=0
  0.214150   10.8.108.4 -> 173.194.45.79 TCP 51031 > https [ACK] Seq=42 Ack=83359 Win=15113 Len=0
  0.214153   10.8.108.4 -> 173.194.45.79 TCP [TCP Window Update] 51031 > https [ACK] Seq=42 Ack=83359 Win=15981 Len=0
  0.214156   10.8.108.4 -> 173.194.45.79 TCP 51031 > https [ACK] Seq=42 Ack=91939 Win=13836 Len=0
  0.214158   10.8.108.4 -> 173.194.45.79 TCP [TCP Window Update] 51031 > https [ACK] Seq=42 Ack=91939 Win=14704 Len=0
  0.214189   10.8.108.4 -> 173.194.45.79 TCP [TCP Window Update] 51031 > https [ACK] Seq=42 Ack=91939 Win=16445 Len=0
  0.214193   10.8.108.4 -> 173.194.45.79 TCP 51031 > https [ACK] Seq=42 Ack=96841 Win=16445 Len=0
  0.214201   10.8.108.4 -> 173.194.45.79 TCP 51031 > https [ACK] Seq=42 Ack=99089 Win=16445 Len=0
  0.214203   10.8.108.4 -> 173.194.45.84 TCP 51132 > https [ACK] Seq=4447 Ack=11060 Win=16445 Len=0
  0.214486  10.8.97.103 -> 157.56.254.246 TCP 53344 > https [ACK] Seq=1 Ack=17881 Win=65335 Len=0
  0.214490  10.8.97.103 -> 157.56.254.246 TCP 53344 > https [ACK] Seq=1 Ack=20526 Win=65335 Len=0
  0.214493  10.8.97.103 -> 157.56.254.246 TCP 53344 > https [ACK] Seq=1 Ack=23171 Win=65335 Len=0
  0.214495  10.8.97.103 -> 157.56.254.246 TCP 53344 > https [ACK] Seq=1 Ack=26091 Win=65335 Len=0
  0.214642  10.8.97.103 -> 157.56.254.246 TCP 53344 > https [ACK] Seq=1 Ack=28736 Win=65335 Len=0
  0.214647  10.8.97.103 -> 157.56.254.246 TCP 53344 > https [ACK] Seq=1 Ack=31381 Win=65335 Len=0
  0.214650 95.211.213.99 -> 10.8.103.72  HTTP Continuation or non-HTTP traffic
  0.215007 95.211.213.99 -> 10.8.103.72  HTTP Continuation or non-HTTP traffic
  0.216039 95.211.213.99 -> 10.8.103.72  HTTP Continuation or non-HTTP traffic
  0.216771 95.211.213.99 -> 10.8.103.72  HTTP Continuation or non-HTTP traffic
  0.217304 95.211.213.99 -> 10.8.103.72  HTTP Continuation or non-HTTP traffic
  0.218260 173.194.5.234 -> 10.8.105.34  HTTP Continuation or non-HTTP traffic
  0.218531 173.194.45.84 -> 10.8.108.4   TLSv1 Application Data
  0.218609 173.194.45.84 -> 10.8.108.4   TLSv1 Application Data
  0.219241 173.194.5.234 -> 10.8.105.34  HTTP Continuation or non-HTTP traffic
  0.219743 173.194.45.84 -> 10.8.108.4   TLSv1 Application Data
  0.219818 173.194.45.84 -> 10.8.108.4   TLSv1 Application Data
  0.219915 173.194.45.84 -> 10.8.108.4   TLSv1 Application Data
  0.220225 173.194.5.234 -> 10.8.105.34  HTTP Continuation or non-HTTP traffic
  0.220702 173.194.5.234 -> 10.8.105.34  HTTP Continuation or non-HTTP traffic
  0.221156 173.194.45.84 -> 10.8.108.4   TLSv1 Application Data
  0.221445 173.194.5.234 -> 10.8.105.34  HTTP Continuation or non-HTTP traffic
  0.222097 173.194.45.84 -> 10.8.108.4   TLSv1 Application Data
  0.222447 173.194.5.234 -> 10.8.105.34  HTTP Continuation or non-HTTP traffic
  0.222929 173.194.5.234 -> 10.8.105.34  HTTP Continuation or non-HTTP traffic
  0.224161 173.194.5.234 -> 10.8.105.34  HTTP Continuation or non-HTTP traffic
  0.225125 173.194.5.234 -> 10.8.105.34  HTTP Continuation or non-HTTP traffic
  0.225867 173.194.5.234 -> 10.8.105.34  HTTP Continuation or non-HTTP traffic
  0.226390 173.194.45.85 -> 10.8.108.146 TCP https > 58205 [ACK] Seq=1 Ack=1431 Win=1979 Len=0 SLE=1 SRE=1431 SLE=2799 SRE=4266
  0.226395 173.194.5.234 -> 10.8.105.34  HTTP Continuation or non-HTTP traffic
  0.227355   10.8.108.4 -> 173.194.45.84 TCP 51132 > https [ACK] Seq=4447 Ack=15857 Win=16445 Len=0
  0.227360   10.8.108.4 -> 173.194.45.84 TLSv1 Change Cipher Spec, Encrypted Handshake Message
  0.227363   10.8.108.4 -> 173.194.45.84 TLSv1 Application Data
  0.227366 108.162.198.194 -> 10.8.110.157 HTTP Continuation or non-HTTP traffic
  0.227435   10.8.108.4 -> 173.194.45.84 TLSv1 Application Data
  0.228015 10.8.106.102 -> 160.92.161.169 TCP 50201 > http [FIN, ACK] Seq=1 Ack=1 Win=16220 Len=0
  0.228332 108.162.198.194 -> 10.8.110.157 HTTP Continuation or non-HTTP traffic
  0.229317 173.194.45.80 -> 10.8.108.4   TCP https > 51126 [FIN, ACK] Seq=1 Ack=1 Win=1002 Len=0
  0.229322 108.162.198.194 -> 10.8.110.157 HTTP Continuation or non-HTTP traffic
