  0.000000 50.7.172.146 -> 10.8.99.219  HTTP Continuation or non-HTTP traffic
  0.000792 50.7.172.146 -> 10.8.99.219  HTTP Continuation or non-HTTP traffic
  0.001973 50.7.172.146 -> 10.8.99.219  HTTP Continuation or non-HTTP traffic
  0.002956 50.7.172.146 -> 10.8.99.219  HTTP Continuation or non-HTTP traffic
  0.004693 50.7.172.146 -> 10.8.99.219  HTTP Continuation or non-HTTP traffic
  0.004964 50.7.172.146 -> 10.8.99.219  HTTP Continuation or non-HTTP traffic
  0.006060 50.7.172.146 -> 10.8.99.219  HTTP Continuation or non-HTTP traffic
  0.006866 50.7.172.146 -> 10.8.99.219  HTTP Continuation or non-HTTP traffic
  0.007146  10.8.99.219 -> 23.21.201.181 TCP 22141 > https [ACK] Seq=1 Ack=1 Win=65522 Len=0 TSV=16945059 TSER=91721892
  0.007681 50.7.172.146 -> 10.8.99.219  HTTP Continuation or non-HTTP traffic
  0.008621 50.7.172.146 -> 10.8.99.219  HTTP Continuation or non-HTTP traffic
  0.009604  10.8.99.219 -> 23.21.201.181 TCP 22141 > https [ACK] Seq=1 Ack=2881 Win=65522 Len=0 TSV=16945061 TSER=91721892
  0.009609 50.7.172.146 -> 10.8.99.219  HTTP Continuation or non-HTTP traffic
  0.010231  10.8.99.219 -> 23.21.201.181 TCP 22141 > https [ACK] Seq=1 Ack=7201 Win=65522 Len=0 TSV=16945061 TSER=91721892
  0.010941 50.7.172.146 -> 10.8.99.219  HTTP Continuation or non-HTTP traffic
  0.011617 50.7.172.146 -> 10.8.99.219  HTTP Continuation or non-HTTP traffic
  0.012360 50.7.172.146 -> 10.8.99.219  HTTP Continuation or non-HTTP traffic
  0.013331 50.7.172.146 -> 10.8.99.219  HTTP Continuation or non-HTTP traffic
  0.014830 50.7.172.146 -> 10.8.99.219  HTTP Continuation or non-HTTP traffic
  0.015300 50.7.172.146 -> 10.8.99.219  HTTP Continuation or non-HTTP traffic
  0.016513 50.7.172.146 -> 10.8.99.219  HTTP Continuation or non-HTTP traffic
  0.017247 50.7.172.146 -> 10.8.99.219  HTTP Continuation or non-HTTP traffic
  0.018214 50.7.172.146 -> 10.8.99.219  HTTP Continuation or non-HTTP traffic
  0.019461 50.7.172.146 -> 10.8.99.219  HTTP Continuation or non-HTTP traffic
  0.020466 50.7.172.146 -> 10.8.99.219  HTTP Continuation or non-HTTP traffic
  0.021460 50.7.172.146 -> 10.8.99.219  HTTP Continuation or non-HTTP traffic
  0.022187 50.7.172.146 -> 10.8.99.219  HTTP Continuation or non-HTTP traffic
  0.022748  10.8.99.219 -> 23.21.201.181 TCP 22141 > https [ACK] Seq=1 Ack=11521 Win=65522 Len=0 TSV=16945061 TSER=91721892
  0.023149 50.7.172.146 -> 10.8.99.219  HTTP Continuation or non-HTTP traffic
  0.023154  10.8.99.219 -> 50.7.172.146 TCP 22172 > http [ACK] Seq=1 Ack=4294950017 Win=65522 Len=0 TSV=16945062 TSER=514332842
  0.024414 50.7.172.146 -> 10.8.99.219  HTTP Continuation or non-HTTP traffic
  0.025139  10.8.99.219 -> 50.7.172.146 TCP 22172 > http [ACK] Seq=1 Ack=4294955777 Win=65522 Len=0 TSV=16945062 TSER=514332842
  0.025144 50.7.172.146 -> 10.8.99.219  HTTP Continuation or non-HTTP traffic
  0.025294  10.8.99.219 -> 50.7.172.146 TCP 22172 > http [ACK] Seq=1 Ack=4294958657 Win=65522 Len=0 TSV=16945062 TSER=514332851
  0.025670  10.8.99.219 -> 50.7.172.146 TCP 22172 > http [ACK] Seq=1 Ack=4294961537 Win=65522 Len=0 TSV=16945062 TSER=514332851
  0.026098  10.8.99.219 -> 50.7.172.146 TCP 22172 > http [ACK] Seq=1 Ack=4294964417 Win=65522 Len=0 TSV=16945062 TSER=514332851
  0.026532  10.8.99.219 -> 50.7.172.146 TCP 22172 > http [ACK] Seq=1 Ack=1 Win=65522 Len=0 TSV=16945062 TSER=514332851
  0.026693  10.8.99.219 -> 50.7.172.146 TCP 22172 > http [ACK] Seq=1 Ack=4321 Win=65522 Len=0 TSV=16945062 TSER=514332851
  0.027162  10.8.99.219 -> 50.7.172.146 TCP 22172 > http [ACK] Seq=1 Ack=7201 Win=65522 Len=0 TSV=16945063 TSER=514332851
  0.027516  10.8.99.219 -> 50.7.172.146 TCP 22172 > http [ACK] Seq=1 Ack=10081 Win=65522 Len=0 TSV=16945063 TSER=514332851
  0.027726  10.8.99.219 -> 50.7.172.146 TCP 22172 > http [ACK] Seq=1 Ack=12961 Win=65522 Len=0 TSV=16945063 TSER=514332854
  0.028089  10.8.99.219 -> 50.7.172.146 TCP 22172 > http [ACK] Seq=1 Ack=15841 Win=65522 Len=0 TSV=16945063 TSER=514332854
  0.028311  10.8.99.219 -> 50.7.172.146 TCP 22172 > http [ACK] Seq=1 Ack=18721 Win=65522 Len=0 TSV=16945063 TSER=514332865
  0.028754  10.8.99.219 -> 50.7.172.146 TCP 22172 > http [ACK] Seq=1 Ack=21601 Win=65522 Len=0 TSV=16945063 TSER=514332865
  0.029215  10.8.99.219 -> 50.7.172.146 TCP 22172 > http [ACK] Seq=1 Ack=24481 Win=65522 Len=0 TSV=16945064 TSER=514332876
  0.030660 50.7.172.146 -> 10.8.99.219  HTTP Continuation or non-HTTP traffic
  0.030784 50.7.172.146 -> 10.8.99.219  HTTP Continuation or non-HTTP traffic
  0.030958 50.7.172.146 -> 10.8.99.219  HTTP Continuation or non-HTTP traffic
  0.031133 50.7.172.146 -> 10.8.99.219  HTTP Continuation or non-HTTP traffic
  0.031296 50.7.172.146 -> 10.8.99.219  HTTP Continuation or non-HTTP traffic
  0.031791 50.7.172.146 -> 10.8.99.219  HTTP Continuation or non-HTTP traffic
  0.031965 50.7.172.146 -> 10.8.99.219  HTTP Continuation or non-HTTP traffic
  0.032762 50.7.172.146 -> 10.8.99.219  HTTP Continuation or non-HTTP traffic
  0.033779 50.7.172.146 -> 10.8.99.219  HTTP Continuation or non-HTTP traffic
  0.034721 50.7.172.146 -> 10.8.99.219  HTTP Continuation or non-HTTP traffic
  0.036207 50.7.172.146 -> 10.8.99.219  HTTP Continuation or non-HTTP traffic
  0.036767 50.7.172.146 -> 10.8.99.219  HTTP Continuation or non-HTTP traffic
  0.037918 50.7.172.146 -> 10.8.99.219  HTTP Continuation or non-HTTP traffic
  0.038728 50.7.172.146 -> 10.8.99.219  HTTP Continuation or non-HTTP traffic
  0.039646 50.7.172.146 -> 10.8.99.219  HTTP Continuation or non-HTTP traffic
  0.040763 50.7.172.146 -> 10.8.99.219  HTTP Continuation or non-HTTP traffic
  0.041628 50.7.172.146 -> 10.8.99.219  HTTP Continuation or non-HTTP traffic
  0.042596 50.7.172.146 -> 10.8.99.219  HTTP Continuation or non-HTTP traffic
  0.043448 50.7.172.146 -> 10.8.99.219  HTTP Continuation or non-HTTP traffic
  0.044334  10.8.99.219 -> 50.7.172.146 TCP 22172 > http [ACK] Seq=1 Ack=27361 Win=65522 Len=0 TSV=16945066 TSER=514332876
  0.044566 50.7.172.146 -> 10.8.99.219  HTTP Continuation or non-HTTP traffic
  0.045362  10.8.99.219 -> 50.7.172.146 TCP 22172 > http [ACK] Seq=1 Ack=30241 Win=65522 Len=0 TSV=16945066 TSER=514332876
  0.045985  10.8.99.219 -> 50.7.172.146 TCP 22172 > http [ACK] Seq=1 Ack=33121 Win=65522 Len=0 TSV=16945066 TSER=514332876
  0.045990 50.7.172.146 -> 10.8.99.219  HTTP Continuation or non-HTTP traffic
  0.046659 50.7.172.146 -> 10.8.99.219  HTTP Continuation or non-HTTP traffic
  0.046911  10.8.99.219 -> 50.7.172.146 TCP 22172 > http [ACK] Seq=1 Ack=36001 Win=65522 Len=0 TSV=16945066 TSER=514332876
  0.047582  10.8.99.219 -> 50.7.172.146 TCP 22177 > http [ACK] Seq=1 Ack=2881 Win=65522 Len=0 TSV=16945066 TSER=514332878
  0.047587 50.7.172.146 -> 10.8.99.219  HTTP Continuation or non-HTTP traffic
  0.048683 50.7.172.146 -> 10.8.99.219  HTTP Continuation or non-HTTP traffic
  0.049264 50.7.172.146 -> 10.8.99.219  HTTP Continuation or non-HTTP traffic
  0.050281 50.7.172.146 -> 10.8.99.219  HTTP Continuation or non-HTTP traffic
  0.050867  10.8.99.219 -> 50.7.172.146 TCP 22177 > http [ACK] Seq=1 Ack=5761 Win=65522 Len=0 TSV=16945066 TSER=514332878
  0.051247 50.7.172.146 -> 10.8.99.219  HTTP Continuation or non-HTTP traffic
  0.052248 50.7.172.146 -> 10.8.99.219  HTTP Continuation or non-HTTP traffic
  0.052347  10.8.99.219 -> 50.7.172.146 TCP 22177 > http [ACK] Seq=1 Ack=8641 Win=65522 Len=0 TSV=16945066 TSER=514332878
  0.053516 50.7.172.146 -> 10.8.99.219  HTTP Continuation or non-HTTP traffic
  0.054413 50.7.172.146 -> 10.8.99.219  HTTP Continuation or non-HTTP traffic
  0.054502  10.8.99.219 -> 50.7.172.146 TCP 22177 > http [ACK] Seq=1 Ack=11521 Win=65522 Len=0 TSV=16945066 TSER=514332881
  0.056119  10.8.99.219 -> 50.7.172.146 TCP 22177 > http [ACK] Seq=1 Ack=14401 Win=65522 Len=0 TSV=16945067 TSER=514332881
  0.056124 50.7.172.146 -> 10.8.99.219  HTTP Continuation or non-HTTP traffic
  0.056382 50.7.172.146 -> 10.8.99.219  HTTP Continuation or non-HTTP traffic
  0.057301 50.7.172.146 -> 10.8.99.219  HTTP Continuation or non-HTTP traffic
  0.058110 50.7.172.146 -> 10.8.99.219  HTTP Continuation or non-HTTP traffic
  0.059105 50.7.172.146 -> 10.8.99.219  HTTP Continuation or non-HTTP traffic
  0.060108 50.7.172.146 -> 10.8.99.219  HTTP Continuation or non-HTTP traffic
  0.060165  10.8.99.219 -> 50.7.172.146 TCP 22177 > http [ACK] Seq=1 Ack=17281 Win=65522 Len=0 TSV=16945067 TSER=514332881
  0.061372 50.7.172.146 -> 10.8.99.219  HTTP Continuation or non-HTTP traffic
  0.061666  10.8.99.219 -> 50.7.172.146 TCP 22177 > http [ACK] Seq=1 Ack=20161 Win=65522 Len=0 TSV=16945067 TSER=514332881
  0.062050 50.7.172.146 -> 10.8.99.219  HTTP Continuation or non-HTTP traffic
  0.062309  10.8.99.219 -> 50.7.172.146 TCP 22177 > http [ACK] Seq=1 Ack=23041 Win=65522 Len=0 TSV=16945067 TSER=514332893
  0.062892 50.7.172.146 -> 10.8.99.219  HTTP Continuation or non-HTTP traffic
  0.063812  10.8.99.219 -> 50.7.172.146 TCP 22177 > http [ACK] Seq=1 Ack=25921 Win=65522 Len=0 TSV=16945067 TSER=514332893
  0.064501  10.8.99.219 -> 50.7.172.146 TCP 22177 > http [ACK] Seq=1 Ack=28801 Win=65522 Len=0 TSV=16945067 TSER=514332893
  0.064980 50.7.172.146 -> 10.8.99.219  HTTP Continuation or non-HTTP traffic
  0.065641 50.7.172.146 -> 10.8.99.219  HTTP Continuation or non-HTTP traffic
  0.066356  10.8.99.219 -> 50.7.172.146 TCP 22177 > http [ACK] Seq=1 Ack=31681 Win=65522 Len=0 TSV=16945067 TSER=514332893
  0.066823 50.7.172.146 -> 10.8.99.219  HTTP Continuation or non-HTTP traffic
  0.067010   10.8.97.65 -> 173.194.66.94 TCP 57380 > https [ACK] Seq=1 Ack=1 Win=16360 Len=0
  0.067869  10.8.99.219 -> 50.7.172.146 TCP 22177 > http [ACK] Seq=1 Ack=34561 Win=65522 Len=0 TSV=16945068 TSER=514332899
  0.068210 50.7.172.146 -> 10.8.99.219  HTTP Continuation or non-HTTP traffic
  0.068470 50.7.172.146 -> 10.8.99.219  HTTP Continuation or non-HTTP traffic
  0.069132 50.7.172.146 -> 10.8.99.219  HTTP Continuation or non-HTTP traffic
  0.069996 50.7.172.146 -> 10.8.99.219  HTTP Continuation or non-HTTP traffic
  0.071000  10.8.99.219 -> 50.7.172.146 TCP 22177 > http [ACK] Seq=1 Ack=37441 Win=65522 Len=0 TSV=16945068 TSER=514332899
  0.071203 50.7.172.146 -> 10.8.99.219  HTTP Continuation or non-HTTP traffic
  0.071330  10.8.99.219 -> 50.7.172.146 TCP 22177 > http [ACK] Seq=1 Ack=40321 Win=65522 Len=0 TSV=16945068 TSER=514332906
  0.072577 50.7.172.146 -> 10.8.99.219  HTTP Continuation or non-HTTP traffic
  0.072947 50.7.172.146 -> 10.8.99.219  HTTP Continuation or non-HTTP traffic
  0.073294  10.8.99.219 -> 50.7.172.146 TCP 22177 > http [ACK] Seq=1 Ack=43201 Win=65522 Len=0 TSV=16945068 TSER=514332906
  0.074462  10.8.99.219 -> 50.7.172.146 TCP 22177 > http [ACK] Seq=1 Ack=47521 Win=65522 Len=0 TSV=16945068 TSER=514332906
  0.074467 50.7.172.146 -> 10.8.99.219  HTTP Continuation or non-HTTP traffic
  0.074902 50.7.172.146 -> 10.8.99.219  HTTP Continuation or non-HTTP traffic
  0.075530  10.8.99.219 -> 50.7.172.146 TCP 22177 > http [ACK] Seq=1 Ack=50401 Win=65522 Len=0 TSV=16945068 TSER=514332906
  0.076104  10.8.99.219 -> 50.7.172.146 TCP 22177 > http [ACK] Seq=1 Ack=54721 Win=65522 Len=0 TSV=16945068 TSER=514332906
  0.076109 50.7.172.146 -> 10.8.99.219  HTTP Continuation or non-HTTP traffic
  0.076368  10.8.106.91 -> 67.228.177.236 TCP 50191 > http [ACK] Seq=1 Ack=1 Win=16425 Len=0
  0.076668  10.8.99.219 -> 50.7.172.146 TCP 22177 > http [ACK] Seq=1 Ack=57601 Win=65522 Len=0 TSV=16945069 TSER=514332906
  0.076911  10.8.99.219 -> 50.7.172.146 TCP 22177 > http [ACK] Seq=1 Ack=61921 Win=65522 Len=0 TSV=16945069 TSER=514332906
  0.077249  10.8.99.219 -> 50.7.172.146 TCP 22177 > http [ACK] Seq=1 Ack=64801 Win=65522 Len=0 TSV=16945069 TSER=514332906
  0.077417  10.8.106.91 -> 67.228.177.236 HTTP POST /urlinfo HTTP/1.1  (application/octet-stream)
  0.077422  10.8.99.219 -> 50.7.172.146 TCP 22177 > http [ACK] Seq=1 Ack=67681 Win=65522 Len=0 TSV=16945069 TSER=514332912
  0.077590  10.8.99.219 -> 50.7.172.146 TCP 22177 > http [ACK] Seq=1 Ack=70561 Win=65522 Len=0 TSV=16945069 TSER=514332912
  0.077956  10.8.99.219 -> 50.7.172.146 TCP 22177 > http [ACK] Seq=1 Ack=73441 Win=65522 Len=0 TSV=16945069 TSER=514332912
  0.079414  10.8.99.219 -> 50.7.172.146 TCP 22177 > http [ACK] Seq=1 Ack=76321 Win=65522 Len=0 TSV=16945069 TSER=514332912
  0.079805 50.7.172.146 -> 10.8.99.219  HTTP Continuation or non-HTTP traffic
  0.080009 50.7.172.146 -> 10.8.99.219  HTTP Continuation or non-HTTP traffic
  0.080178 50.7.172.146 -> 10.8.99.219  HTTP Continuation or non-HTTP traffic
  0.081089 50.7.172.146 -> 10.8.99.219  HTTP Continuation or non-HTTP traffic
  0.081380 50.7.172.146 -> 10.8.99.219  HTTP Continuation or non-HTTP traffic
  0.081803 50.7.172.146 -> 10.8.99.219  HTTP Continuation or non-HTTP traffic
  0.082562 50.7.172.146 -> 10.8.99.219  HTTP Continuation or non-HTTP traffic
  0.083747 50.7.172.146 -> 10.8.99.219  HTTP Continuation or non-HTTP traffic
  0.084512 50.7.172.146 -> 10.8.99.219  HTTP Continuation or non-HTTP traffic
  0.085523 50.7.172.146 -> 10.8.99.219  HTTP Continuation or non-HTTP traffic
  0.086487 50.7.172.146 -> 10.8.99.219  HTTP Continuation or non-HTTP traffic
  0.087696 50.7.172.146 -> 10.8.99.219  HTTP Continuation or non-HTTP traffic
  0.088677 50.7.172.146 -> 10.8.99.219  HTTP Continuation or non-HTTP traffic
  0.089445 50.7.172.146 -> 10.8.99.219  HTTP Continuation or non-HTTP traffic
  0.090753 50.7.172.146 -> 10.8.99.219  HTTP Continuation or non-HTTP traffic
  0.091424 50.7.172.146 -> 10.8.99.219  HTTP Continuation or non-HTTP traffic
  0.092371 50.7.172.146 -> 10.8.99.219  HTTP Continuation or non-HTTP traffic
  0.093368 50.7.172.146 -> 10.8.99.219  HTTP Continuation or non-HTTP traffic
  0.094331 50.7.172.146 -> 10.8.99.219  HTTP Continuation or non-HTTP traffic
  0.095324 50.7.172.146 -> 10.8.99.219  HTTP Continuation or non-HTTP traffic
  0.096180 50.7.172.146 -> 10.8.99.219  HTTP Continuation or non-HTTP traffic
  0.097065 50.7.172.146 -> 10.8.99.219  HTTP Continuation or non-HTTP traffic
  0.097323  10.8.99.219 -> 50.7.172.146 TCP 22172 > http [ACK] Seq=1 Ack=38881 Win=65522 Len=0 TSV=16945071 TSER=514332964
  0.098610 112.210.245.215 -> 10.8.109.65  UDP Source port: 61137  Destination port: 47313
  0.098615 50.7.172.146 -> 10.8.99.219  HTTP Continuation or non-HTTP traffic
  0.100047 50.7.172.146 -> 10.8.99.219  HTTP Continuation or non-HTTP traffic
  0.100391 50.7.172.146 -> 10.8.99.219  HTTP Continuation or non-HTTP traffic
  0.100446  10.8.109.65 -> 112.210.245.215 UDP Source port: 47313  Destination port: 61137
  0.100918 68:96:7b:af:8d:59 -> HewlettP_3f:f2:82 ARP Who has 10.8.97.1?  Tell 10.8.100.160
  0.101085 HewlettP_3f:f2:82 -> 68:96:7b:af:8d:59 ARP 10.8.97.1 is at 00:08:02:3f:f2:82
  0.101091 50.7.172.146 -> 10.8.99.219  HTTP Continuation or non-HTTP traffic
  0.101480  10.8.99.219 -> 50.7.172.146 TCP 22172 > http [ACK] Seq=1 Ack=41761 Win=65522 Len=0 TSV=16945071 TSER=514332964
  0.102260 50.7.172.146 -> 10.8.99.219  HTTP Continuation or non-HTTP traffic
  0.102964  10.8.99.219 -> 50.7.172.146 TCP 22172 > http [ACK] Seq=1 Ack=44641 Win=65522 Len=0 TSV=16945072 TSER=514332964
  0.103235 50.7.172.146 -> 10.8.99.219  HTTP Continuation or non-HTTP traffic
  0.104243 50.7.172.146 -> 10.8.99.219  HTTP Continuation or non-HTTP traffic
  0.105206  10.8.99.219 -> 50.7.172.146 TCP 22172 > http [ACK] Seq=1 Ack=48961 Win=65522 Len=0 TSV=16945072 TSER=514332964
  0.105210 50.7.172.146 -> 10.8.99.219  HTTP Continuation or non-HTTP traffic
  0.106211  10.8.99.219 -> 50.7.172.146 TCP 22172 > http [ACK] Seq=1 Ack=54721 Win=65522 Len=0 TSV=16945072 TSER=514332969
  0.106424 50.7.172.146 -> 10.8.99.219  HTTP Continuation or non-HTTP traffic
  0.107399 50.7.172.146 -> 10.8.99.219  HTTP Continuation or non-HTTP traffic
  0.108150 50.7.172.146 -> 10.8.99.219  HTTP Continuation or non-HTTP traffic
  0.108919 50.7.172.146 -> 10.8.99.219  HTTP Continuation or non-HTTP traffic
  0.109677  10.8.99.219 -> 50.7.172.146 TCP 22172 > http [ACK] Seq=1 Ack=57601 Win=65522 Len=0 TSV=16945072 TSER=514332969
  0.110100 50.7.172.146 -> 10.8.99.219  HTTP Continuation or non-HTTP traffic
  0.111144  10.8.99.219 -> 50.7.172.146 TCP 22172 > http [ACK] Seq=1 Ack=64801 Win=65522 Len=0 TSV=16945072 TSER=514332969
  0.111395 50.7.172.146 -> 10.8.99.219  HTTP Continuation or non-HTTP traffic
  0.111880 50.7.172.146 -> 10.8.99.219  HTTP Continuation or non-HTTP traffic
  0.112092  10.8.99.219 -> 50.7.172.146 TCP 22172 > http [ACK] Seq=1 Ack=67681 Win=65522 Len=0 TSV=16945072 TSER=514332969
  0.112350  10.8.99.219 -> 50.7.172.146 TCP 22172 > http [ACK] Seq=1 Ack=74881 Win=65522 Len=0 TSV=16945073 TSER=514332969
  0.113226 50.7.172.146 -> 10.8.99.219  HTTP Continuation or non-HTTP traffic
  0.113867 50.7.172.146 -> 10.8.99.219  HTTP Continuation or non-HTTP traffic
  0.114819 50.7.172.146 -> 10.8.99.219  HTTP Continuation or non-HTTP traffic
  0.115952 50.7.172.146 -> 10.8.99.219  HTTP Continuation or non-HTTP traffic
  0.116755 50.7.172.146 -> 10.8.99.219  HTTP Continuation or non-HTTP traffic
  0.116795  10.8.99.219 -> 50.7.172.146 TCP 22172 > http [ACK] Seq=1 Ack=77761 Win=65522 Len=0 TSV=16945073 TSER=514332985
  0.117326  10.8.99.219 -> 50.7.172.146 TCP 22172 > http [ACK] Seq=1 Ack=80641 Win=65522 Len=0 TSV=16945073 TSER=514332985
  0.118010 50.7.172.146 -> 10.8.99.219  HTTP Continuation or non-HTTP traffic
  0.118263  10.8.99.219 -> 50.7.172.146 TCP 22172 > http [ACK] Seq=1 Ack=84961 Win=65522 Len=0 TSV=16945073 TSER=514332985
  0.118645 50.7.172.146 -> 10.8.99.219  HTTP Continuation or non-HTTP traffic
  0.119310  10.8.99.219 -> 50.7.172.146 TCP 22172 > http [ACK] Seq=1 Ack=90721 Win=65522 Len=0 TSV=16945073 TSER=514332985
  0.119484  10.8.99.219 -> 50.7.172.146 TCP 22172 > http [ACK] Seq=1 Ack=93601 Win=65522 Len=0 TSV=16945073 TSER=514332985
  0.119749 50.7.172.146 -> 10.8.99.219  HTTP Continuation or non-HTTP traffic
  0.119855  10.8.99.219 -> 50.7.172.146 TCP 22172 > http [ACK] Seq=1 Ack=96481 Win=65522 Len=0 TSV=16945073 TSER=514332988
  0.120877  10.8.99.219 -> 50.7.172.146 TCP 22172 > http [ACK] Seq=1 Ack=99361 Win=65522 Len=0 TSV=16945074 TSER=514332988
  0.121372 50.7.172.146 -> 10.8.99.219  HTTP Continuation or non-HTTP traffic
  0.122061  10.8.99.219 -> 50.7.172.146 TCP 22177 > http [ACK] Seq=1 Ack=79201 Win=65522 Len=0 TSV=16945074 TSER=514332912
  0.122066 50.7.172.146 -> 10.8.99.219  HTTP Continuation or non-HTTP traffic
  0.122714 50.7.172.146 -> 10.8.99.219  HTTP Continuation or non-HTTP traffic
  0.123669  10.8.99.219 -> 50.7.172.146 TCP 22177 > http [ACK] Seq=1 Ack=82081 Win=65522 Len=0 TSV=16945074 TSER=514332992
  0.123673 50.7.172.146 -> 10.8.99.219  HTTP Continuation or non-HTTP traffic
  0.124806 23.21.201.181 -> 10.8.99.219  SSL Continuation Data
  0.125476 23.21.201.181 -> 10.8.99.219  SSL Continuation Data
  0.126442 23.21.201.181 -> 10.8.99.219  SSL Continuation Data
  0.127411  10.8.99.219 -> 23.21.201.181 TCP 22141 > https [ACK] Seq=1 Ack=14401 Win=65522 Len=0 TSV=16945074 TSER=91721930
  0.127416 23.21.201.181 -> 10.8.99.219  SSL Continuation Data
  0.128587 23.21.201.181 -> 10.8.99.219  SSL Continuation Data
  0.129359 23.21.201.181 -> 10.8.99.219  SSL Continuation Data
  0.129645  10.8.99.219 -> 23.21.201.181 TCP 22141 > https [ACK] Seq=1 Ack=17281 Win=65522 Len=0 TSV=16945075 TSER=91721930
  0.130343 50.7.172.146 -> 10.8.99.219  HTTP Continuation or non-HTTP traffic
  0.131332 50.7.172.146 -> 10.8.99.219  HTTP Continuation or non-HTTP traffic
  0.132089 50.7.172.146 -> 10.8.99.219  HTTP Continuation or non-HTTP traffic
  0.132234  10.8.99.219 -> 23.21.201.181 TCP 22141 > https [ACK] Seq=1 Ack=20161 Win=65522 Len=0 TSV=16945075 TSER=91721930
  0.133402  10.8.99.219 -> 50.7.172.146 TCP 22177 > http [ACK] Seq=1 Ack=84961 Win=65522 Len=0 TSV=16945075 TSER=514332992
  0.133407 50.7.172.146 -> 10.8.99.219  HTTP Continuation or non-HTTP traffic
  0.134113  10.8.99.219 -> 50.7.172.146 TCP 22177 > http [ACK] Seq=1 Ack=87841 Win=65522 Len=0 TSV=16945075 TSER=514332995
  0.134482 50.7.172.146 -> 10.8.99.219  HTTP Continuation or non-HTTP traffic
  0.135315 50.7.172.146 -> 10.8.99.219  HTTP Continuation or non-HTTP traffic
  0.135851  10.8.99.219 -> 50.7.172.146 TCP 22177 > http [ACK] Seq=1 Ack=90721 Win=65522 Len=0 TSV=16945075 TSER=514332995
  0.136175 50.7.172.146 -> 10.8.99.219  HTTP Continuation or non-HTTP traffic
  0.137068 50.7.172.146 -> 10.8.99.219  HTTP Continuation or non-HTTP traffic
  0.138192 50.7.172.146 -> 10.8.99.219  HTTP Continuation or non-HTTP traffic
  0.139200  10.8.99.219 -> 50.7.172.146 TCP 22177 > http [ACK] Seq=1 Ack=93601 Win=65522 Len=0 TSV=16945075 TSER=514333001
  0.139205 50.7.172.146 -> 10.8.99.219  HTTP Continuation or non-HTTP traffic
  0.140065  10.8.99.219 -> 50.7.172.146 TCP 22177 > http [ACK] Seq=1 Ack=96481 Win=65522 Len=0 TSV=16945076 TSER=514333001
  0.140262 50.7.172.146 -> 10.8.99.219  HTTP Continuation or non-HTTP traffic
  0.141324 50.7.172.146 -> 10.8.99.219  HTTP Continuation or non-HTTP traffic
  0.141919 50.7.172.146 -> 10.8.99.219  HTTP Continuation or non-HTTP traffic
  0.142029  10.8.99.219 -> 50.7.172.146 TCP 22177 > http [ACK] Seq=1 Ack=99361 Win=65522 Len=0 TSV=16945076 TSER=514333007
  0.143203 50.7.172.146 -> 10.8.99.219  HTTP Continuation or non-HTTP traffic
  0.143888 50.7.172.146 -> 10.8.99.219  HTTP Continuation or non-HTTP traffic
  0.144331  10.8.99.219 -> 50.7.172.146 TCP 22177 > http [ACK] Seq=1 Ack=102241 Win=65522 Len=0 TSV=16945076 TSER=514333007
  0.144842 50.7.172.146 -> 10.8.99.219  HTTP Continuation or non-HTTP traffic
  0.146003 50.7.172.146 -> 10.8.99.219  HTTP Continuation or non-HTTP traffic
  0.146244  10.8.99.219 -> 50.7.172.146 TCP 22177 > http [ACK] Seq=1 Ack=105121 Win=65522 Len=0 TSV=16945076 TSER=514333007
  0.146631 50.7.172.146 -> 10.8.99.219  HTTP Continuation or non-HTTP traffic
  0.147825 50.7.172.146 -> 10.8.99.219  HTTP Continuation or non-HTTP traffic
  0.147911  10.8.105.55 -> 31.13.80.17  SSL Continuation Data
  0.147933  10.8.99.219 -> 50.7.172.146 TCP 22177 > http [ACK] Seq=1 Ack=108001 Win=65522 Len=0 TSV=16945076 TSER=514333007
  0.149359 50.7.172.146 -> 10.8.99.219  HTTP Continuation or non-HTTP traffic
  0.149615 50.7.172.146 -> 10.8.99.219  HTTP Continuation or non-HTTP traffic
  0.150571 50.7.172.146 -> 10.8.99.219  HTTP Continuation or non-HTTP traffic
  0.151514 50.7.172.146 -> 10.8.99.219  HTTP Continuation or non-HTTP traffic
  0.152092  10.8.99.219 -> 50.7.172.146 TCP 22177 > http [ACK] Seq=1 Ack=110881 Win=65522 Len=0 TSV=16945077 TSER=514333007
  0.152482 50.7.172.146 -> 10.8.99.219  HTTP Continuation or non-HTTP traffic
  0.152880  10.8.99.219 -> 50.7.172.146 TCP 22177 > http [ACK] Seq=1 Ack=113761 Win=65522 Len=0 TSV=16945077 TSER=514333012
  0.153119  10.8.99.219 -> 50.7.172.146 TCP 22177 > http [ACK] Seq=1 Ack=116641 Win=65522 Len=0 TSV=16945077 TSER=514333012
  0.153523 50.7.172.146 -> 10.8.99.219  HTTP Continuation or non-HTTP traffic
  0.154208  10.8.99.219 -> 50.7.172.146 TCP 22177 > http [ACK] Seq=1 Ack=119521 Win=65522 Len=0 TSV=16945077 TSER=514333014
  0.154529 50.7.172.146 -> 10.8.99.219  HTTP Continuation or non-HTTP traffic
  0.156750 23.21.201.181 -> 10.8.99.219  SSL Continuation Data
  0.156974 23.21.201.181 -> 10.8.99.219  SSL Continuation Data
  0.157687 23.21.201.181 -> 10.8.99.219  SSL Continuation Data
  0.158496 23.21.201.181 -> 10.8.99.219  SSL Continuation Data
  0.159417 50.7.172.146 -> 10.8.99.219  HTTP Continuation or non-HTTP traffic
  0.159587  10.8.99.219 -> 23.21.201.181 TCP 22141 > https [ACK] Seq=1 Ack=23041 Win=65522 Len=0 TSV=16945077 TSER=91721938
  0.160994 50.7.172.146 -> 10.8.99.219  HTTP Continuation or non-HTTP traffic
  0.161381 50.7.172.146 -> 10.8.99.219  HTTP Continuation or non-HTTP traffic
  0.161924  10.8.99.219 -> 23.21.201.181 TCP 22141 > https [ACK] Seq=1 Ack=25921 Win=65522 Len=0 TSV=16945078 TSER=91721938
  0.162341 50.7.172.146 -> 10.8.99.219  HTTP Continuation or non-HTTP traffic
  0.163028  10.8.99.219 -> 50.7.172.146 TCP 22177 > http [ACK] Seq=1 Ack=122401 Win=65522 Len=0 TSV=16945078 TSER=514333014
  0.163397 50.7.172.146 -> 10.8.99.219  HTTP Continuation or non-HTTP traffic
  0.163744  10.8.99.219 -> 50.7.172.146 TCP 22177 > http [ACK] Seq=1 Ack=125281 Win=65522 Len=0 TSV=16945078 TSER=514333026
  0.164356 50.7.172.146 -> 10.8.99.219  HTTP Continuation or non-HTTP traffic
  0.165324  10.8.99.219 -> 50.7.172.146 TCP 22177 > http [ACK] Seq=1 Ack=128161 Win=65522 Len=0 TSV=16945078 TSER=514333026
  0.165329 50.7.172.146 -> 10.8.99.219  HTTP Continuation or non-HTTP traffic
  0.166462 50.7.172.146 -> 10.8.99.219  HTTP Continuation or non-HTTP traffic
  0.166595  10.8.99.219 -> 50.7.172.146 TCP 22177 > http [ACK] Seq=1 Ack=131041 Win=65522 Len=0 TSV=16945078 TSER=514333026
  0.167041 50.7.172.146 -> 10.8.99.219  HTTP Continuation or non-HTTP traffic
  0.168077  10.8.99.219 -> 50.7.172.146 TCP 22177 > http [ACK] Seq=1 Ack=133921 Win=65522 Len=0 TSV=16945078 TSER=514333026
  0.168082 50.7.172.146 -> 10.8.99.219  HTTP Continuation or non-HTTP traffic
  0.169256 50.7.172.146 -> 10.8.99.219  HTTP Continuation or non-HTTP traffic
  0.169999 50.7.172.146 -> 10.8.99.219  HTTP Continuation or non-HTTP traffic
  0.170060  10.8.99.219 -> 50.7.172.146 TCP 22177 > http [ACK] Seq=1 Ack=136801 Win=65522 Len=0 TSV=16945079 TSER=514333026
  0.171303 50.7.172.146 -> 10.8.99.219  HTTP Continuation or non-HTTP traffic
  0.172195 50.7.172.146 -> 10.8.99.219  HTTP Continuation or non-HTTP traffic
  0.172987 50.7.172.146 -> 10.8.99.219  HTTP Continuation or non-HTTP traffic
  0.173936 50.7.172.146 -> 10.8.99.219  HTTP Continuation or non-HTTP traffic
  0.173997  10.8.99.219 -> 50.7.172.146 TCP 22177 > http [ACK] Seq=1 Ack=141121 Win=65522 Len=0 TSV=16945079 TSER=514333026
  0.175219 50.7.172.146 -> 10.8.99.219  HTTP Continuation or non-HTTP traffic
  0.176035 50.7.172.146 -> 10.8.99.219  HTTP Continuation or non-HTTP traffic
  0.176883 50.7.172.146 -> 10.8.99.219  HTTP Continuation or non-HTTP traffic
  0.176995  10.8.99.219 -> 50.7.172.146 TCP 22177 > http [ACK] Seq=1 Ack=145441 Win=65522 Len=0 TSV=16945079 TSER=514333026
  0.177074  10.8.109.65 -> 122.52.193.19 UDP Source port: 47313  Destination port: 23173
  0.177769 23.21.201.181 -> 10.8.99.219  SSL Continuation Data
  0.177851  10.8.109.65 -> 120.147.8.29 UDP Source port: 47313  Destination port: 39081
  0.178016  10.8.109.65 -> 112.208.166.219 UDP Source port: 47313  Destination port: 40960
  0.178148  10.8.109.65 -> 109.228.67.87 UDP Source port: 47313  Destination port: 27834
  0.178451  10.8.109.65 -> 109.86.247.7 UDP Source port: 47313  Destination port: 10774
  0.178530  10.8.99.219 -> 50.7.172.146 TCP 22177 > http [ACK] Seq=1 Ack=148321 Win=65522 Len=0 TSV=16945079 TSER=514333027
  0.183074 10.8.101.250 -> 10.8.111.255 NBNS Name query NB VOLTAIRE<20>
  0.186900 23.21.201.181 -> 10.8.99.219  SSL Continuation Data
  0.187117 23.21.201.181 -> 10.8.99.219  SSL Continuation Data
  0.187301 23.21.201.181 -> 10.8.99.219  SSL Continuation Data
  0.187480 23.21.201.181 -> 10.8.99.219  SSL Continuation Data
  0.187664 23.21.201.181 -> 10.8.99.219  SSL Continuation Data
  0.187848 23.21.201.181 -> 10.8.99.219  SSL Continuation Data
  0.188033 23.21.201.181 -> 10.8.99.219  SSL Continuation Data
  0.188278 50.7.172.146 -> 10.8.99.219  HTTP Continuation or non-HTTP traffic
  0.188449 50.7.172.146 -> 10.8.99.219  HTTP Continuation or non-HTTP traffic
  0.188933 50.7.172.146 -> 10.8.99.219  HTTP Continuation or non-HTTP traffic
  0.189231 50.7.172.146 -> 10.8.99.219  HTTP Continuation or non-HTTP traffic
  0.189713 50.7.172.146 -> 10.8.99.219  HTTP Continuation or non-HTTP traffic
  0.190574 50.7.172.146 -> 10.8.99.219  HTTP Continuation or non-HTTP traffic
  0.191475 50.7.172.146 -> 10.8.99.219  HTTP Continuation or non-HTTP traffic
  0.192395 50.7.172.146 -> 10.8.99.219  HTTP Continuation or non-HTTP traffic
  0.193387 50.7.172.146 -> 10.8.99.219  HTTP Continuation or non-HTTP traffic
  0.194383 50.7.172.146 -> 10.8.99.219  HTTP Continuation or non-HTTP traffic
  0.195152 50.7.172.146 -> 10.8.99.219  HTTP Continuation or non-HTTP traffic
  0.196393 50.7.172.146 -> 10.8.99.219  HTTP Continuation or non-HTTP traffic
  0.197110 50.7.172.146 -> 10.8.99.219  HTTP Continuation or non-HTTP traffic
  0.198079 50.7.172.146 -> 10.8.99.219  HTTP Continuation or non-HTTP traffic
  0.198758  10.8.109.65 -> 81.83.48.8   TCP 23285 > 38570 [SYN] Seq=0 Win=8192 Len=0 MSS=1460 WS=2
  0.198928  10.8.109.65 -> 78.72.119.69 TCP 23283 > 65497 [SYN] Seq=0 Win=8192 Len=0 MSS=1460 WS=2
  0.199089 50.7.172.146 -> 10.8.99.219  HTTP Continuation or non-HTTP traffic
  0.200478 50.7.172.146 -> 10.8.99.219  HTTP Continuation or non-HTTP traffic
  0.201257 50.7.172.146 -> 10.8.99.219  HTTP Continuation or non-HTTP traffic
  0.201500  10.8.99.219 -> 23.21.201.181 TCP 22141 > https [ACK] Seq=1 Ack=28801 Win=65522 Len=0 TSV=16945082 TSER=91721942
  0.201819 50.7.172.146 -> 10.8.99.219  HTTP Continuation or non-HTTP traffic
  0.202341  10.8.109.65 -> 83.109.167.144 TCP 23260 > 21011 [SYN] Seq=0 Win=8192 Len=0 MSS=1460
  0.202544  10.8.99.219 -> 23.21.201.181 TCP 22141 > https [ACK] Seq=1 Ack=31681 Win=65522 Len=0 TSV=16945082 TSER=91721942
  0.203040 50.7.172.146 -> 10.8.99.219  HTTP Continuation or non-HTTP traffic
  0.203614  10.8.109.65 -> 78.60.240.32 TCP 23261 > 62040 [SYN] Seq=0 Win=8192 Len=0 MSS=1460
  0.203618  10.8.99.219 -> 23.21.201.181 TCP 22141 > https [ACK] Seq=1 Ack=34561 Win=65522 Len=0 TSV=16945082 TSER=91721942
  0.203771  10.8.109.65 -> 77.46.252.68 TCP 23263 > filenet-tms [SYN] Seq=0 Win=8192 Len=0 MSS=1460
  0.204045 50.7.172.146 -> 10.8.99.219  HTTP Continuation or non-HTTP traffic
  0.205288  10.8.109.65 -> 81.100.208.73 TCP 23262 > 45798 [SYN] Seq=0 Win=8192 Len=0 MSS=1460
  0.205551 50.7.172.146 -> 10.8.99.219  HTTP Continuation or non-HTTP traffic
  0.206755  10.8.99.219 -> 23.21.201.181 TCP 22141 > https [ACK] Seq=1 Ack=37441 Win=65522 Len=0 TSV=16945082 TSER=91721942
  0.206761 50.7.172.146 -> 10.8.99.219  HTTP Continuation or non-HTTP traffic
  0.207056 50.7.172.146 -> 10.8.99.219  HTTP Continuation or non-HTTP traffic
  0.207342  10.8.99.219 -> 50.7.172.146 TCP 22172 > http [ACK] Seq=1 Ack=102241 Win=65522 Len=0 TSV=16945082 TSER=514332988
  0.208005 50.7.172.146 -> 10.8.99.219  HTTP Continuation or non-HTTP traffic
  0.208352  10.8.109.65 -> 85.243.134.81 TCP 23294 > 57036 [SYN] Seq=0 Win=8192 Len=0 MSS=1460 WS=2
  0.208976 50.7.172.146 -> 10.8.99.219  HTTP Continuation or non-HTTP traffic
  0.209115  10.8.99.219 -> 50.7.172.146 TCP 22172 > http [ACK] Seq=1 Ack=105121 Win=65522 Len=0 TSV=16945082 TSER=514333043
  0.209745  10.8.109.65 -> 71.202.96.157 TCP 23295 > 51413 [SYN] Seq=0 Win=8192 Len=0 MSS=1460 WS=2
  0.209904  10.8.109.65 -> 85.72.207.78 UDP Source port: 47313  Destination port: 57110
  0.210036  10.8.109.65 -> 85.72.207.78 TCP 23296 > 57110 [SYN] Seq=0 Win=8192 Len=0 MSS=1460 WS=2
  0.210164  10.8.109.65 -> 85.218.53.163 UDP Source port: 47313  Destination port: 51413
  0.210289  10.8.109.65 -> 85.218.53.163 TCP 23297 > 51413 [SYN] Seq=0 Win=8192 Len=0 MSS=1460 WS=2
  0.210422  10.8.109.65 -> 85.243.134.81 UDP Source port: 47313  Destination port: 57036
  0.210426  10.8.99.219 -> 50.7.172.146 TCP 22172 > http [ACK] Seq=1 Ack=108001 Win=65522 Len=0 TSV=16945082 TSER=514333043
  0.210985  10.8.99.219 -> 50.7.172.146 TCP 22172 > http [ACK] Seq=1 Ack=112321 Win=65522 Len=0 TSV=16945082 TSER=514333046
  0.211808 50.7.172.146 -> 10.8.99.219  HTTP Continuation or non-HTTP traffic
  0.212055  10.8.99.219 -> 50.7.172.146 TCP 22172 > http [ACK] Seq=1 Ack=115201 Win=65522 Len=0 TSV=16945082 TSER=514333046
  0.212207  10.8.99.219 -> 50.7.172.146 TCP 22172 > http [ACK] Seq=1 Ack=118081 Win=65522 Len=0 TSV=16945083 TSER=514333050
  0.213707  10.8.99.219 -> 50.7.172.146 TCP 22172 > http [ACK] Seq=1 Ack=120961 Win=65522 Len=0 TSV=16945083 TSER=514333050
  0.214379  10.8.99.219 -> 50.7.172.146 TCP 22172 > http [ACK] Seq=1 Ack=123841 Win=65522 Len=0 TSV=16945083 TSER=514333050
  0.214971  10.8.99.219 -> 50.7.172.146 TCP 22172 > http [ACK] Seq=1 Ack=128161 Win=65522 Len=0 TSV=16945083 TSER=514333057
  0.217206  10.8.99.219 -> 50.7.172.146 TCP 22172 > http [ACK] Seq=1 Ack=131041 Win=65522 Len=0 TSV=16945083 TSER=514333057
  0.217932  10.8.99.219 -> 50.7.172.146 TCP 22172 > http [ACK] Seq=1 Ack=133921 Win=65522 Len=0 TSV=16945083 TSER=514333057
  0.217938 50.7.172.146 -> 10.8.99.219  HTTP Continuation or non-HTTP traffic
  0.218151 50.7.172.146 -> 10.8.99.219  HTTP Continuation or non-HTTP traffic
  0.218320 50.7.172.146 -> 10.8.99.219  HTTP Continuation or non-HTTP traffic
  0.218511 50.7.172.146 -> 10.8.99.219  HTTP Continuation or non-HTTP traffic
  0.218676 50.7.172.146 -> 10.8.99.219  HTTP Continuation or non-HTTP traffic
  0.218850 50.7.172.146 -> 10.8.99.219  HTTP Continuation or non-HTTP traffic
  0.219028 50.7.172.146 -> 10.8.99.219  HTTP Continuation or non-HTTP traffic
  0.219200  10.8.99.219 -> 50.7.172.146 TCP 22172 > http [ACK] Seq=1 Ack=136801 Win=65522 Len=0 TSV=16945083 TSER=514333057
  0.219205 50.7.172.146 -> 10.8.99.219  HTTP Continuation or non-HTTP traffic
  0.219866  10.8.99.219 -> 50.7.172.146 TCP 22172 > http [ACK] Seq=1 Ack=139681 Win=65522 Len=0 TSV=16945084 TSER=514333057
  0.220587 50.7.172.146 -> 10.8.99.219  HTTP Continuation or non-HTTP traffic
  0.220767 50.7.172.146 -> 10.8.99.219  HTTP Continuation or non-HTTP traffic
  0.220941 50.7.172.146 -> 10.8.99.219  HTTP Continuation or non-HTTP traffic
  0.221769 50.7.172.146 -> 10.8.99.219  HTTP Continuation or non-HTTP traffic
  0.222251 50.7.172.146 -> 10.8.99.219  HTTP Continuation or non-HTTP traffic
  0.223448 50.7.172.146 -> 10.8.99.219  HTTP Continuation or non-HTTP traffic
  0.223914  10.8.99.219 -> 50.7.172.146 TCP 22172 > http [ACK] Seq=1 Ack=142561 Win=65522 Len=0 TSV=16945084 TSER=514333057
  0.224432 50.7.172.146 -> 10.8.99.219  HTTP Continuation or non-HTTP traffic
  0.224920  10.8.99.219 -> 50.7.172.146 TCP 22172 > http [ACK] Seq=1 Ack=145441 Win=65522 Len=0 TSV=16945084 TSER=514333062
  0.225511 50.7.172.146 -> 10.8.99.219  HTTP Continuation or non-HTTP traffic
  0.226044  10.8.99.219 -> 50.7.172.146 TCP 22172 > http [ACK] Seq=1 Ack=148321 Win=65522 Len=0 TSV=16945084 TSER=514333062
  0.226444  10.8.99.219 -> 50.7.172.146 TCP 22172 > http [ACK] Seq=1 Ack=151201 Win=65522 Len=0 TSV=16945084 TSER=514333062
  0.226616 50.7.172.146 -> 10.8.99.219  HTTP Continuation or non-HTTP traffic
  0.227224  10.8.99.219 -> 50.7.172.146 TCP 22172 > http [ACK] Seq=1 Ack=154081 Win=65522 Len=0 TSV=16945084 TSER=514333062
  0.227617  10.8.99.219 -> 50.7.172.146 TCP 22172 > http [ACK] Seq=1 Ack=156961 Win=65522 Len=0 TSV=16945084 TSER=514333062
  0.227622 50.7.172.146 -> 10.8.99.219  HTTP Continuation or non-HTTP traffic
  0.228802 50.7.172.146 -> 10.8.99.219  HTTP Continuation or non-HTTP traffic
  0.229162 50.7.172.146 -> 10.8.99.219  HTTP Continuation or non-HTTP traffic
  0.230385 50.7.172.146 -> 10.8.99.219  HTTP Continuation or non-HTTP traffic
  0.231143 50.7.172.146 -> 10.8.99.219  HTTP Continuation or non-HTTP traffic
  0.231490  10.8.99.219 -> 50.7.172.146 TCP 22172 > http [ACK] Seq=1 Ack=159841 Win=65522 Len=0 TSV=16945084 TSER=514333062
  0.232097 50.7.172.146 -> 10.8.99.219  HTTP Continuation or non-HTTP traffic
  0.232849 50.7.172.146 -> 10.8.99.219  HTTP Continuation or non-HTTP traffic
  0.233032  10.8.99.219 -> 50.7.172.146 TCP 22172 > http [ACK] Seq=1 Ack=162721 Win=65522 Len=0 TSV=16945084 TSER=514333062
  0.234219 50.7.172.146 -> 10.8.99.219  HTTP Continuation or non-HTTP traffic
  0.235036 50.7.172.146 -> 10.8.99.219  HTTP Continuation or non-HTTP traffic
  0.236048 50.7.172.146 -> 10.8.99.219  HTTP Continuation or non-HTTP traffic
  0.236765 50.7.172.146 -> 10.8.99.219  HTTP Continuation or non-HTTP traffic
  0.236826  10.8.99.219 -> 50.7.172.146 TCP 22177 > http [ACK] Seq=1 Ack=151201 Win=65522 Len=0 TSV=16945085 TSER=514333063
  0.237504  10.8.99.219 -> 50.7.172.146 TCP 22177 > http [ACK] Seq=1 Ack=154081 Win=65522 Len=0 TSV=16945085 TSER=514333063
  0.237725  10.8.99.219 -> 50.7.172.146 TCP 22177 > http [ACK] Seq=1 Ack=156961 Win=65522 Len=0 TSV=16945085 TSER=514333063
  0.238025  10.8.99.219 -> 50.7.172.146 TCP 22177 > http [ACK] Seq=1 Ack=159841 Win=65522 Len=0 TSV=16945085 TSER=514333074
  0.238030 50.7.172.146 -> 10.8.99.219  HTTP Continuation or non-HTTP traffic
  0.238735  10.8.99.219 -> 50.7.172.146 TCP 22177 > http [ACK] Seq=1 Ack=162721 Win=65522 Len=0 TSV=16945085 TSER=514333074
  0.239401 50.7.172.146 -> 10.8.99.219  HTTP Continuation or non-HTTP traffic
  0.240042 50.7.172.146 -> 10.8.99.219  HTTP Continuation or non-HTTP traffic
  0.240960 50.7.172.146 -> 10.8.99.219  HTTP Continuation or non-HTTP traffic
  0.241924  10.8.99.219 -> 50.7.172.146 TCP 22177 > http [ACK] Seq=1 Ack=167041 Win=65522 Len=0 TSV=16945086 TSER=514333077
  0.241929 50.7.172.146 -> 10.8.99.219  HTTP Continuation or non-HTTP traffic
  0.243068 50.7.172.146 -> 10.8.99.219  HTTP Continuation or non-HTTP traffic
  0.243710 50.7.172.146 -> 10.8.99.219  HTTP Continuation or non-HTTP traffic
  0.244409  10.8.99.219 -> 50.7.172.146 TCP 22177 > http [ACK] Seq=1 Ack=171361 Win=65522 Len=0 TSV=16945086 TSER=514333077
  0.246494 50.7.172.146 -> 10.8.99.219  HTTP Continuation or non-HTTP traffic
  0.246799 50.7.172.146 -> 10.8.99.219  HTTP Continuation or non-HTTP traffic
  0.247050 50.7.172.146 -> 10.8.99.219  HTTP Continuation or non-HTTP traffic
  0.247580 50.7.172.146 -> 10.8.99.219  HTTP Continuation or non-HTTP traffic
  0.248575 50.7.172.146 -> 10.8.99.219  HTTP Continuation or non-HTTP traffic
  0.249570  10.8.99.219 -> 50.7.172.146 TCP 22177 > http [ACK] Seq=1 Ack=177121 Win=65522 Len=0 TSV=16945087 TSER=514333083
  0.249575 50.7.172.146 -> 10.8.99.219  HTTP Continuation or non-HTTP traffic
  0.250884 50.7.172.146 -> 10.8.99.219  HTTP Continuation or non-HTTP traffic
  0.251099  10.8.99.219 -> 50.7.172.146 TCP 22177 > http [ACK] Seq=1 Ack=180001 Win=65522 Len=0 TSV=16945087 TSER=514333087
  0.251570 50.7.172.146 -> 10.8.99.219  HTTP Continuation or non-HTTP traffic
  0.252336 50.7.172.146 -> 10.8.99.219  HTTP Continuation or non-HTTP traffic
  0.253275  10.8.99.219 -> 50.7.172.146 TCP 22177 > http [ACK] Seq=1 Ack=182881 Win=65522 Len=0 TSV=16945087 TSER=514333087
  0.253281 50.7.172.146 -> 10.8.99.219  HTTP Continuation or non-HTTP traffic
  0.254434 50.7.172.146 -> 10.8.99.219  HTTP Continuation or non-HTTP traffic
  0.255229 50.7.172.146 -> 10.8.99.219  HTTP Continuation or non-HTTP traffic
  0.256283 50.7.172.146 -> 10.8.99.219  HTTP Continuation or non-HTTP traffic
  0.257438 50.7.172.146 -> 10.8.99.219  HTTP Continuation or non-HTTP traffic
  0.258425 50.7.172.146 -> 10.8.99.219  HTTP Continuation or non-HTTP traffic
  0.259242 50.7.172.146 -> 10.8.99.219  HTTP Continuation or non-HTTP traffic
  0.260174 50.7.172.146 -> 10.8.99.219  HTTP Continuation or non-HTTP traffic
  0.261415 50.7.172.146 -> 10.8.99.219  HTTP Continuation or non-HTTP traffic
  0.262158 50.7.172.146 -> 10.8.99.219  HTTP Continuation or non-HTTP traffic
  0.263125 50.7.172.146 -> 10.8.99.219  HTTP Continuation or non-HTTP traffic
  0.263930 50.7.172.146 -> 10.8.99.219  HTTP Continuation or non-HTTP traffic
  0.265079 50.7.172.146 -> 10.8.99.219  HTTP Continuation or non-HTTP traffic
  0.266138 50.7.172.146 -> 10.8.99.219  HTTP Continuation or non-HTTP traffic
  0.266853 50.7.172.146 -> 10.8.99.219  HTTP Continuation or non-HTTP traffic
  0.268028 50.7.172.146 -> 10.8.99.219  HTTP Continuation or non-HTTP traffic
  0.268804 50.7.172.146 -> 10.8.99.219  HTTP Continuation or non-HTTP traffic
  0.269772 50.7.172.146 -> 10.8.99.219  HTTP Continuation or non-HTTP traffic
  0.270811 50.7.172.146 -> 10.8.99.219  HTTP Continuation or non-HTTP traffic
  0.271732 50.7.172.146 -> 10.8.99.219  HTTP Continuation or non-HTTP traffic
  0.272722 50.7.172.146 -> 10.8.99.219  HTTP Continuation or non-HTTP traffic
  0.273461 50.7.172.146 -> 10.8.99.219  HTTP Continuation or non-HTTP traffic
