  0.000000   10.8.107.3 -> 93.88.240.2  TCP 59280 > http [ACK] Seq=1 Ack=1 Win=115 Len=0
  0.031063  10.8.105.23 -> 255.255.255.255 UDP Source port: 17500  Destination port: 17500
  0.031677  10.8.105.23 -> 10.8.111.255 UDP Source port: 17500  Destination port: 17500
  0.036125 10.8.108.135 -> 157.56.52.19 TCP 58944 > 40017 [ACK] Seq=1 Ack=1 Win=62 Len=0
  0.119780  10.8.105.23 -> 10.8.111.255 NBNS Name query NB VOLTAIRE<20>
  0.174606   10.8.97.92 -> 10.8.111.255 BROWSER Host Announcement MIROOKU-PC, Workstation, Server, NT Workstation, Potential Browser
  0.201929 173.194.66.101 -> 10.8.103.68  HTTP HTTP/1.1 204 No Content 
  0.207800 157.56.52.19 -> 10.8.108.135 TCP 40017 > 58944 [PSH, ACK] Seq=1 Ack=1 Win=50 Len=410
  0.208019  10.8.96.237 -> 74.125.132.125 SSL Continuation Data
  0.242816 74.125.132.125 -> 10.8.96.237  TCP https > 53922 [ACK] Seq=1 Ack=2 Win=1002 Len=0 SLE=1 SRE=2
  0.243367 173.194.66.101 -> 10.8.103.68  TCP http > 55223 [SYN, ACK] Seq=0 Ack=0 Win=62920 Len=0 MSS=1430 WS=6
  0.266707 173.194.66.193 -> 10.8.98.38   TLSv1.2 Application Data
  0.271836 HewlettP_3f:f2:82 -> Broadcast    ARP Who has 10.8.111.201?  Tell 10.8.97.1
  0.290753  5.153.10.62 -> 10.8.105.245 TCP fmpro-internal > 50111 [PSH, ACK] Seq=1 Ack=1 Win=5792 Len=29 TSV=3952378754 TSER=599358584
  0.359251   10.8.107.3 -> 84.16.67.209 TCP 41535 > http [ACK] Seq=1 Ack=1 Win=636 Len=0
  0.363279  10.8.103.68 -> 173.194.66.101 TCP [TCP segment of a reassembled PDU]
  0.367200   10.8.99.45 -> 226.178.217.5 UDP Source port: 61870  Destination port: 21328
  0.371970 10.8.105.245 -> 5.153.10.62  TCP 50111 > fmpro-internal [ACK] Seq=1 Ack=30 Win=65535 Len=0 TSV=599360369 TSER=3952378754
  0.407733 173.194.20.242 -> 10.8.103.68  TCP http > 55224 [SYN, ACK] Seq=0 Ack=0 Win=14600 Len=0 MSS=1460 WS=6
  0.408449 173.194.66.101 -> 10.8.103.68  TCP [TCP Dup ACK 7#1] [TCP ACKed lost segment] http > 55211 [ACK] Seq=413 Ack=1 Win=1002 Len=0 SLE=4294965591 SRE=4294967021
  0.418603  5.153.10.62 -> 10.8.105.245 TCP fmpro-internal > 50111 [PSH, ACK] Seq=30 Ack=1 Win=5792 Len=30 TSV=3952378883 TSER=599360369
  0.419570  5.153.10.62 -> 10.8.105.245 TCP fmpro-internal > 50111 [PSH, ACK] Seq=60 Ack=1 Win=5792 Len=1026 TSV=3952378883 TSER=599360369
  0.423418   10.8.107.3 -> 84.16.67.209 TCP 41535 > http [ACK] Seq=1 Ack=2905 Win=636 Len=0
  0.427599 7c:e9:d3:2d:8b:b6 -> HewlettP_3f:f2:82 ARP Who has 10.8.97.1?  Tell 10.8.99.45
  0.427659 HewlettP_3f:f2:82 -> 7c:e9:d3:2d:8b:b6 ARP 10.8.97.1 is at 00:08:02:3f:f2:82
  0.437977  10.8.110.95 -> 111.221.74.29 UDP Source port: 8483  Destination port: 40042
  0.442061  10.8.103.68 -> 173.194.20.242 TCP 55219 > http [ACK] Seq=1 Ack=1 Win=2132 Len=0 SLE=1453 SRE=2905
  0.457827  10.8.103.68 -> 173.194.20.242 TCP [TCP segment of a reassembled PDU]
  0.460863 84.16.67.209 -> 10.8.107.3   HTTP Continuation or non-HTTP traffic
  0.461569 84.16.67.209 -> 10.8.107.3   HTTP Continuation or non-HTTP traffic
  0.462553  10.8.103.68 -> 173.194.20.242 TCP [TCP Dup ACK 27#1] 55219 > http [ACK] Seq=1 Ack=1 Win=2132 Len=0 SLE=1453 SRE=4357
  0.464733  10.8.103.68 -> 173.194.20.242 TCP [TCP Dup ACK 27#2] 55219 > http [ACK] Seq=1 Ack=1 Win=2132 Len=0 SLE=1453 SRE=5809
  0.468122 84.16.67.209 -> 10.8.107.3   HTTP Continuation or non-HTTP traffic
  0.468743 84.16.67.209 -> 10.8.107.3   HTTP Continuation or non-HTTP traffic
  0.469682 84.16.67.209 -> 10.8.107.3   HTTP Continuation or non-HTTP traffic
  0.473241 173.194.20.242 -> 10.8.103.68  HTTP Continuation or non-HTTP traffic
  0.477824 173.194.66.101 -> 10.8.103.68  HTTP [TCP Retransmission] HTTP/1.1 204 No Content 
  0.498171 173.194.20.242 -> 10.8.103.68  TCP [TCP ACKed lost segment] http > 55218 [ACK] Seq=94577 Ack=2484 Win=502 Len=0 SLE=1 SRE=1453
  0.499956 173.194.20.242 -> 10.8.103.68  HTTP Continuation or non-HTTP traffic
  0.500945 173.194.20.242 -> 10.8.103.68  HTTP [TCP Out-Of-Order] Continuation or non-HTTP traffic
  0.508784 10.8.105.245 -> 5.153.10.62  TCP 50111 > fmpro-internal [ACK] Seq=1 Ack=1086 Win=65535 Len=0 TSV=599360417 TSER=3952378883
  0.510237 10.8.105.245 -> 5.153.10.62  TCP [TCP Dup ACK 41#1] 50111 > fmpro-internal [ACK] Seq=1 Ack=1086 Win=65535 Len=0 TSV=599360423 TSER=3952378883
  0.513800 111.221.77.151 -> 10.8.110.95  UDP Source port: 40003  Destination port: 8483
  0.521013  10.8.110.38 -> 130.117.190.186 TCP 50570 > https [ACK] Seq=1 Ack=1 Win=4356 Len=0
  0.527791   10.8.107.3 -> 93.88.240.2  TCP 59279 > http [FIN, ACK] Seq=1 Ack=1 Win=124 Len=0
  0.531721  10.8.103.68 -> 173.194.20.242 TCP [TCP Dup ACK 27#3] 55219 > http [ACK] Seq=1 Ack=1 Win=2132 Len=0 SLE=1453 SRE=7261
  0.533954  10.8.103.68 -> 173.194.20.242 TCP [TCP Dup ACK 27#4] 55219 > http [ACK] Seq=1 Ack=1 Win=2132 Len=0 SLE=1453 SRE=8713
  0.542189  10.8.110.38 -> 130.117.190.186 SSL Continuation Data
  0.555295  5.153.10.62 -> 10.8.105.245 TCP fmpro-internal > 50111 [ACK] Seq=1086 Ack=1 Win=5792 Len=1440 TSV=3952379017 TSER=599360417
  0.555323  5.153.10.62 -> 10.8.105.245 TCP fmpro-internal > 50111 [PSH, ACK] Seq=2526 Ack=1 Win=5792 Len=369 TSV=3952379017 TSER=599360417
  0.562340 173.194.20.242 -> 10.8.103.68  HTTP Continuation or non-HTTP traffic
  0.564840 173.194.20.242 -> 10.8.103.68  HTTP Continuation or non-HTTP traffic
  0.568354  93.88.240.2 -> 10.8.107.3   TCP http > 59279 [ACK] Seq=2 Ack=2 Win=109 Len=0
  0.579316 10.8.105.245 -> 5.153.10.62  TCP 50111 > fmpro-internal [ACK] Seq=1 Ack=2895 Win=65535 Len=0 TSV=599360574 TSER=3952379017
  0.585955 130.117.190.186 -> 10.8.110.38  SSL Continuation Data
  0.597746  5.153.10.62 -> 10.8.105.245 TCP fmpro-internal > 50111 [PSH, ACK] Seq=2895 Ack=1 Win=5792 Len=74 TSV=3952379061 TSER=599360423
  0.600839 10.8.105.245 -> 5.153.10.62  TCP 50111 > fmpro-internal [ACK] Seq=1 Ack=2969 Win=65535 Len=0 TSV=599360595 TSER=3952379061
  0.611749  10.8.103.68 -> 173.194.20.242 TCP 55218 > http [ACK] Seq=2484 Ack=1780 Win=1823 Len=0
  0.615768  10.8.103.68 -> 173.194.20.242 TCP 55218 > http [ACK] Seq=2484 Ack=4684 Win=1811 Len=0
  0.620050 173.194.66.193 -> 10.8.98.38   TLSv1.2 [TCP Retransmission] Application Data
  0.620935  10.8.103.68 -> 173.194.20.242 TCP 55218 > http [ACK] Seq=2484 Ack=6136 Win=1806 Len=0
  0.621674  10.8.103.68 -> 173.194.20.242 TCP 55218 > http [ACK] Seq=2484 Ack=9040 Win=1794 Len=0
  0.623648  5.153.10.62 -> 10.8.105.245 TCP fmpro-internal > 50111 [PSH, ACK] Seq=2969 Ack=1 Win=5792 Len=134 TSV=3952379088 TSER=599360574
  0.627695 fe80::bd21:d50b:5d0f:19eb -> ff02::1:3    LLMNR Standard query A isatap
  0.629686  10.8.103.68 -> 173.194.20.242 TCP 55218 > http [ACK] Seq=2484 Ack=14848 Win=1772 Len=0
  0.631834  10.8.109.65 -> 224.0.0.252  LLMNR Standard query A isatap
  0.632702  10.8.103.68 -> 173.194.20.242 TCP 55218 > http [ACK] Seq=2484 Ack=22108 Win=1743 Len=0
  0.636688 10.8.105.245 -> 5.153.10.62  TCP 50111 > fmpro-internal [ACK] Seq=1 Ack=3103 Win=65535 Len=0 TSV=599360620 TSER=3952379088
  0.636907  10.8.103.68 -> 173.194.20.242 TCP 55218 > http [ACK] Seq=2484 Ack=23560 Win=1738 Len=0 SLE=32272 SRE=33724
  0.639898  10.8.103.68 -> 173.194.20.242 TCP [TCP Dup ACK 69#1] 55218 > http [ACK] Seq=2484 Ack=23560 Win=1738 Len=0 SLE=36628 SRE=38080 SLE=32272 SRE=33724
  0.640595  10.8.103.68 -> 173.194.20.242 TCP [TCP Dup ACK 69#2] 55218 > http [ACK] Seq=2484 Ack=23560 Win=1738 Len=0 SLE=36628 SRE=39532 SLE=32272 SRE=33724
  0.642406 173.194.20.242 -> 10.8.103.68  HTTP Continuation or non-HTTP traffic
  0.643406 173.194.20.242 -> 10.8.103.68  HTTP Continuation or non-HTTP traffic
  0.652023 173.194.20.242 -> 10.8.103.68  HTTP Continuation or non-HTTP traffic
  0.653234 173.194.20.242 -> 10.8.103.68  HTTP Continuation or non-HTTP traffic
  0.660183 173.194.20.242 -> 10.8.103.68  HTTP Continuation or non-HTTP traffic
  0.663627 173.194.20.242 -> 10.8.103.68  HTTP Continuation or non-HTTP traffic
  0.668399 173.194.20.242 -> 10.8.103.68  HTTP [TCP Retransmission] Continuation or non-HTTP traffic
  0.669226 173.194.20.242 -> 10.8.103.68  HTTP [TCP Retransmission] Continuation or non-HTTP traffic
  0.670938 173.194.20.242 -> 10.8.103.68  HTTP [TCP Retransmission] Continuation or non-HTTP traffic
  0.671410   10.8.107.3 -> 93.88.240.2  TCP 59279 > http [ACK] Seq=2 Ack=2 Win=124 Len=0
  0.671965 173.194.20.242 -> 10.8.103.68  HTTP [TCP Retransmission] Continuation or non-HTTP traffic
  0.686207   10.8.107.3 -> 84.16.67.209 TCP 41535 > http [ACK] Seq=1 Ack=4357 Win=636 Len=0
  0.706673  10.8.103.68 -> 173.194.20.242 TCP [TCP Dup ACK 69#3] 55218 > http [ACK] Seq=2484 Ack=23560 Win=1738 Len=0 SLE=40984 SRE=42436 SLE=36628 SRE=39532 SLE=32272 SRE=33724
  0.707446  10.8.103.68 -> 173.194.20.242 TCP [TCP Dup ACK 69#4] 55218 > http [ACK] Seq=2484 Ack=23560 Win=1738 Len=0 SLE=43888 SRE=45340 SLE=40984 SRE=42436 SLE=36628 SRE=39532 SLE=32272 SRE=33724
  0.712797  10.8.103.68 -> 173.194.20.242 TCP [TCP Dup ACK 69#5] 55218 > http [ACK] Seq=2484 Ack=23560 Win=1738 Len=0 SLE=43888 SRE=46792 SLE=40984 SRE=42436 SLE=36628 SRE=39532 SLE=32272 SRE=33724
  0.713910  10.8.103.68 -> 173.194.20.242 TCP [TCP Dup ACK 69#6] 55218 > http [ACK] Seq=2484 Ack=23560 Win=1738 Len=0 SLE=43888 SRE=48244 SLE=40984 SRE=42436 SLE=36628 SRE=39532 SLE=32272 SRE=33724
  0.714289 111.221.74.29 -> 10.8.110.95  UDP Source port: 40042  Destination port: 8483
  0.716380  10.8.103.68 -> 173.194.20.242 TCP [TCP Dup ACK 69#7] 55218 > http [ACK] Seq=2484 Ack=23560 Win=1738 Len=0 SLE=43888 SRE=49696 SLE=40984 SRE=42436 SLE=36628 SRE=39532 SLE=32272 SRE=33724
  0.717370  10.8.103.68 -> 173.194.20.242 TCP [TCP Dup ACK 69#8] 55218 > http [ACK] Seq=2484 Ack=23560 Win=1738 Len=0 SLE=61312 SRE=62764 SLE=43888 SRE=49696 SLE=40984 SRE=42436 SLE=36628 SRE=39532
  0.722247  10.8.103.68 -> 173.194.20.242 TCP [TCP Dup ACK 69#9] 55218 > http [ACK] Seq=2484 Ack=23560 Win=1738 Len=0 SLE=61312 SRE=64216 SLE=43888 SRE=49696 SLE=40984 SRE=42436 SLE=36628 SRE=39532
  0.722988  10.8.103.68 -> 173.194.20.242 TCP [TCP Dup ACK 69#10] 55218 > http [ACK] Seq=2484 Ack=23560 Win=1738 Len=0 SLE=61312 SRE=65537 SLE=43888 SRE=49696 SLE=40984 SRE=42436 SLE=36628 SRE=39532
  0.723703  10.8.103.68 -> 173.194.20.242 TCP [TCP Dup ACK 69#11] 55218 > http [ACK] Seq=2484 Ack=23560 Win=1738 Len=0 SLE=61312 SRE=66989 SLE=43888 SRE=49696 SLE=40984 SRE=42436 SLE=36628 SRE=39532
  0.724393  10.8.103.68 -> 173.194.20.242 TCP [TCP Dup ACK 69#12] 55218 > http [ACK] Seq=2484 Ack=23560 Win=1738 Len=0 SLE=61312 SRE=68441 SLE=43888 SRE=49696 SLE=40984 SRE=42436 SLE=36628 SRE=39532
  0.725047  10.8.103.68 -> 173.194.20.242 TCP [TCP Dup ACK 69#13] 55218 > http [ACK] Seq=2484 Ack=23560 Win=1738 Len=0 SLE=71345 SRE=72797 SLE=61312 SRE=68441 SLE=43888 SRE=49696 SLE=40984 SRE=42436
  0.726267  10.8.103.68 -> 173.194.20.242 TCP [TCP Dup ACK 69#14] 55218 > http [ACK] Seq=2484 Ack=23560 Win=1738 Len=0 SLE=71345 SRE=74249 SLE=61312 SRE=68441 SLE=43888 SRE=49696 SLE=40984 SRE=42436
  0.726935  10.8.103.68 -> 173.194.20.242 TCP [TCP Dup ACK 69#15] 55218 > http [ACK] Seq=2484 Ack=23560 Win=1738 Len=0 SLE=71345 SRE=75701 SLE=61312 SRE=68441 SLE=43888 SRE=49696 SLE=40984 SRE=42436
  0.727596  10.8.103.68 -> 173.194.20.242 TCP [TCP Dup ACK 69#16] 55218 > http [ACK] Seq=2484 Ack=23560 Win=1738 Len=0 SLE=71345 SRE=77153 SLE=61312 SRE=68441 SLE=43888 SRE=49696 SLE=40984 SRE=42436
  0.727884 fe80::bd21:d50b:5d0f:19eb -> ff02::1:3    LLMNR Standard query A isatap
  0.728366  10.8.103.68 -> 173.194.20.242 TCP [TCP Dup ACK 69#17] 55218 > http [ACK] Seq=2484 Ack=23560 Win=1738 Len=0 SLE=71345 SRE=78605 SLE=61312 SRE=68441 SLE=43888 SRE=49696 SLE=40984 SRE=42436
  0.729048  10.8.103.68 -> 173.194.20.242 TCP [TCP Dup ACK 69#18] 55218 > http [ACK] Seq=2484 Ack=23560 Win=1738 Len=0 SLE=82961 SRE=84413 SLE=71345 SRE=78605 SLE=61312 SRE=68441 SLE=43888 SRE=49696
  0.730366  10.8.103.68 -> 173.194.20.242 TCP [TCP Dup ACK 69#19] 55218 > http [ACK] Seq=2484 Ack=23560 Win=1738 Len=0 SLE=87317 SRE=88769 SLE=82961 SRE=84413 SLE=71345 SRE=78605 SLE=61312 SRE=68441
  0.731016  10.8.103.68 -> 173.194.20.242 TCP [TCP Dup ACK 69#20] 55218 > http [ACK] Seq=2484 Ack=23560 Win=1738 Len=0 SLE=87317 SRE=90221 SLE=82961 SRE=84413 SLE=71345 SRE=78605 SLE=61312 SRE=68441
  0.731294  10.8.109.65 -> 224.0.0.252  LLMNR Standard query A isatap
  0.732203  10.8.103.68 -> 173.194.20.242 TCP [TCP Dup ACK 69#21] 55218 > http [ACK] Seq=2484 Ack=23560 Win=1738 Len=0 SLE=93125 SRE=94577 SLE=87317 SRE=90221 SLE=82961 SRE=84413 SLE=71345 SRE=78605
  0.733412  10.8.103.68 -> 173.194.66.139 TCP 55220 > http [ACK] Seq=1 Ack=1 Win=3003 Len=0
  0.736693  10.8.103.68 -> 173.194.66.139 TCP 55220 > http [ACK] Seq=1 Ack=5721 Win=2994 Len=0
  0.737635  10.8.103.68 -> 173.194.66.139 TCP 55220 > http [ACK] Seq=1 Ack=10011 Win=2994 Len=0
  0.738016 173.194.20.242 -> 10.8.103.68  HTTP [TCP Retransmission] Continuation or non-HTTP traffic
  0.738871  10.8.103.68 -> 173.194.66.139 TCP 55220 > http [ACK] Seq=1 Ack=11441 Win=2994 Len=0
  0.741673  10.8.103.68 -> 173.194.66.139 TCP 55220 > http [ACK] Seq=1 Ack=13194 Win=2994 Len=0
  0.742288  10.8.103.68 -> 173.194.66.139 TCP 55220 > http [ACK] Seq=1 Ack=17484 Win=2994 Len=0
  0.744917 173.194.20.242 -> 10.8.103.68  HTTP [TCP Retransmission] Continuation or non-HTTP traffic
  0.745851 173.194.20.242 -> 10.8.103.68  HTTP [TCP Retransmission] Continuation or non-HTTP traffic
  0.745979  10.8.103.68 -> 173.194.66.139 TCP 55220 > http [ACK] Seq=1 Ack=18914 Win=2994 Len=0
  0.746547  10.8.103.68 -> 173.194.66.139 TCP 55220 > http [ACK] Seq=1 Ack=23204 Win=2994 Len=0
  0.747734 173.194.20.242 -> 10.8.103.68  HTTP [TCP Retransmission] Continuation or non-HTTP traffic
  0.747832 HewlettP_3f:f2:82 -> IntelCor_b7:fe:46 ARP Who has 10.8.102.145?  Tell 10.8.97.1
  0.748699  10.8.103.68 -> 173.194.66.139 TCP 55220 > http [ACK] Seq=1 Ack=24634 Win=2994 Len=0
  0.748871 173.194.20.242 -> 10.8.103.68  HTTP [TCP Retransmission] Continuation or non-HTTP traffic
  0.749866 173.194.20.242 -> 10.8.103.68  HTTP [TCP Retransmission] Continuation or non-HTTP traffic
  0.750396  10.8.103.68 -> 173.194.20.242 TCP [TCP Dup ACK 69#22] 55218 > http [ACK] Seq=2484 Ack=23560 Win=1738 Len=0 SLE=1 SRE=328 SLE=93125 SRE=94577 SLE=87317 SRE=90221 SLE=82961 SRE=84413
  0.750765 173.194.20.242 -> 10.8.103.68  HTTP [TCP Retransmission] Continuation or non-HTTP traffic
  0.751274  10.8.103.68 -> 173.194.66.139 TCP 55220 > http [ACK] Seq=1 Ack=29578 Win=2994 Len=0
  0.753571 173.194.20.242 -> 10.8.103.68  HTTP [TCP Retransmission] Continuation or non-HTTP traffic
  0.754255 173.194.20.242 -> 10.8.103.68  HTTP [TCP Retransmission] Continuation or non-HTTP traffic
  0.754735  10.8.103.68 -> 173.194.66.139 TCP 55220 > http [ACK] Seq=1 Ack=33868 Win=2994 Len=0
  0.755224 173.194.20.242 -> 10.8.103.68  HTTP [TCP Retransmission] Continuation or non-HTTP traffic
  0.756210 173.194.20.242 -> 10.8.103.68  HTTP [TCP Retransmission] Continuation or non-HTTP traffic
  0.757183 173.194.20.242 -> 10.8.103.68  HTTP [TCP Retransmission] Continuation or non-HTTP traffic
  0.757835  10.8.103.68 -> 173.194.66.139 TCP 55220 > http [ACK] Seq=1 Ack=35298 Win=3776 Len=0
  0.758510 173.194.20.242 -> 10.8.103.68  HTTP [TCP Retransmission] Continuation or non-HTTP traffic
  0.758832  10.8.103.68 -> 173.194.66.139 TCP 55220 > http [ACK] Seq=1 Ack=43878 Win=3776 Len=0
  0.759191 173.194.20.242 -> 10.8.103.68  HTTP [TCP Retransmission] Continuation or non-HTTP traffic
  0.759398  10.8.103.68 -> 173.194.66.139 TCP 55220 > http [ACK] Seq=1 Ack=51682 Win=3776 Len=0
  0.760499 173.194.20.242 -> 10.8.103.68  HTTP Continuation or non-HTTP traffic
  0.760903 173.194.20.242 -> 10.8.103.68  HTTP Continuation or non-HTTP traffic
  0.761874 173.194.20.242 -> 10.8.103.68  HTTP Continuation or non-HTTP traffic
  0.762790  10.8.103.68 -> 173.194.66.139 TCP 55220 > http [ACK] Seq=1 Ack=55972 Win=3776 Len=0
  0.763187 173.194.20.242 -> 10.8.103.68  HTTP [TCP Out-Of-Order] Continuation or non-HTTP traffic
  0.763958 173.194.20.242 -> 10.8.103.68  HTTP Continuation or non-HTTP traffic
  0.764222  10.8.103.68 -> 173.194.66.139 TCP 55220 > http [ACK] Seq=1 Ack=58832 Win=3776 Len=0
  0.764851  10.8.103.68 -> 173.194.66.139 TCP 55220 > http [ACK] Seq=1 Ack=61692 Win=3764 Len=0
  0.764856 173.194.20.242 -> 10.8.103.68  HTTP [TCP Out-Of-Order] Continuation or non-HTTP traffic
  0.765940 173.194.20.242 -> 10.8.103.68  HTTP Continuation or non-HTTP traffic
  0.767027 173.194.20.242 -> 10.8.103.68  HTTP Continuation or non-HTTP traffic
  0.767226  10.8.103.68 -> 173.194.66.139 TCP 55220 > http [ACK] Seq=1 Ack=62334 Win=3762 Len=0
  0.767842 HewlettP_3f:f2:82 -> Broadcast    ARP Who has 10.8.110.93?  Tell 10.8.97.1
  0.768385 173.194.20.242 -> 10.8.103.68  HTTP Continuation or non-HTTP traffic
  0.768512  10.8.103.68 -> 173.194.66.139 TCP 55220 > http [ACK] Seq=1 Ack=65194 Win=3751 Len=0
  0.768821 173.194.20.242 -> 10.8.103.68  HTTP Continuation or non-HTTP traffic
  0.769006  10.8.103.68 -> 173.194.66.139 TCP 55220 > http [ACK] Seq=1 Ack=68054 Win=3740 Len=0
  0.770158 173.194.20.242 -> 10.8.103.68  HTTP [TCP Out-Of-Order] Continuation or non-HTTP traffic
  0.770761 173.194.20.242 -> 10.8.103.68  HTTP Continuation or non-HTTP traffic
  0.771388  10.8.103.68 -> 173.194.66.139 TCP 55220 > http [ACK] Seq=1 Ack=70914 Win=3728 Len=0
  0.771750 173.194.20.242 -> 10.8.103.68  HTTP [TCP Out-Of-Order] Continuation or non-HTTP traffic
  0.772271  10.8.103.68 -> 173.194.66.139 TCP 55220 > http [ACK] Seq=1 Ack=73774 Win=3725 Len=0
  0.772783 173.194.20.242 -> 10.8.103.68  HTTP [TCP Out-Of-Order] Continuation or non-HTTP traffic
  0.773880 173.194.20.242 -> 10.8.103.68  HTTP [TCP Retransmission] Continuation or non-HTTP traffic
  0.774670 173.194.20.242 -> 10.8.103.68  HTTP Continuation or non-HTTP traffic
  0.775444 173.194.20.242 -> 10.8.103.68  HTTP [TCP Out-Of-Order] Continuation or non-HTTP traffic
  0.775964  10.8.103.68 -> 173.194.66.139 TCP 55220 > http [ACK] Seq=1 Ack=76634 Win=3725 Len=0
  0.776418 173.194.20.242 -> 10.8.103.68  HTTP Continuation or non-HTTP traffic
  0.776545  10.8.103.68 -> 173.194.66.139 TCP 55220 > http [ACK] Seq=1 Ack=78718 Win=3717 Len=0
  0.777752 84.16.67.209 -> 10.8.107.3   HTTP Continuation or non-HTTP traffic
  0.778402 173.194.66.139 -> 10.8.103.68  HTTP Continuation or non-HTTP traffic
  0.779365 173.194.66.139 -> 10.8.103.68  HTTP Continuation or non-HTTP traffic
  0.780326 173.194.66.139 -> 10.8.103.68  HTTP Continuation or non-HTTP traffic
  0.781320 173.194.66.139 -> 10.8.103.68  HTTP Continuation or non-HTTP traffic
  0.782091 173.194.66.139 -> 10.8.103.68  HTTP Continuation or non-HTTP traffic
  0.783373 173.194.66.139 -> 10.8.103.68  HTTP Continuation or non-HTTP traffic
  0.784528 173.194.66.139 -> 10.8.103.68  HTTP Continuation or non-HTTP traffic
  0.785302 173.194.66.139 -> 10.8.103.68  HTTP Continuation or non-HTTP traffic
  0.786261 173.194.66.139 -> 10.8.103.68  HTTP Continuation or non-HTTP traffic
  0.786500 173.194.66.139 -> 10.8.103.68  HTTP Continuation or non-HTTP traffic
  0.787522 173.194.20.242 -> 10.8.103.68  HTTP Continuation or non-HTTP traffic
  0.794817  10.8.103.68 -> 173.194.20.242 TCP [TCP Dup ACK 27#5] 55219 > http [ACK] Seq=1 Ack=1 Win=2132 Len=0 SLE=1453 SRE=10165
  0.796250  10.8.103.68 -> 173.194.20.242 TCP [TCP Dup ACK 27#6] 55219 > http [ACK] Seq=1 Ack=1 Win=2132 Len=0 SLE=1453 SRE=11617
  0.796833  10.8.103.68 -> 173.194.20.242 TCP [TCP Dup ACK 27#7] 55219 > http [ACK] Seq=1 Ack=1 Win=2132 Len=0 SLE=1453 SRE=13069
  0.797869  10.8.103.68 -> 173.194.20.242 TCP [TCP Dup ACK 27#8] 55219 > http [ACK] Seq=1 Ack=1 Win=2132 Len=0 SLE=1453 SRE=14521
  0.798511  10.8.103.68 -> 173.194.20.242 TCP [TCP Dup ACK 27#9] 55219 > http [ACK] Seq=1 Ack=1 Win=2132 Len=0 SLE=1453 SRE=15973
  0.801145  10.8.103.68 -> 173.194.20.242 TCP [TCP Dup ACK 27#10] 55219 > http [ACK] Seq=1 Ack=1 Win=2132 Len=0 SLE=1453 SRE=17425
  0.804960  10.8.103.68 -> 173.194.20.242 TCP [TCP Dup ACK 27#11] 55219 > http [ACK] Seq=1 Ack=1 Win=2132 Len=0 SLE=1453 SRE=18877
  0.805673  10.8.103.68 -> 173.194.20.242 TCP [TCP Dup ACK 27#12] 55219 > http [ACK] Seq=1 Ack=1 Win=2132 Len=0 SLE=1453 SRE=20329
  0.806293  10.8.103.68 -> 173.194.20.242 TCP [TCP Dup ACK 27#13] 55219 > http [ACK] Seq=1 Ack=1 Win=2132 Len=0 SLE=1453 SRE=21781
  0.806976  10.8.103.68 -> 173.194.20.242 TCP [TCP Dup ACK 27#14] 55219 > http [ACK] Seq=1 Ack=1 Win=2132 Len=0 SLE=1453 SRE=23233
  0.807589  10.8.103.68 -> 173.194.20.242 TCP [TCP Dup ACK 27#15] 55219 > http [ACK] Seq=1 Ack=1 Win=2132 Len=0 SLE=1453 SRE=24685
  0.810124   10.8.98.38 -> 173.194.66.193 TCP 54290 > https [ACK] Seq=1 Ack=425 Win=8207 Len=0 TSV=432366794 TSER=1171825179
  0.810397   10.8.98.38 -> 173.194.66.193 TCP [TCP Dup ACK 188#1] 54290 > https [ACK] Seq=1 Ack=425 Win=8207 Len=0 TSV=432366794 TSER=1171825179
  0.811248   10.8.98.38 -> 173.194.66.193 TCP [TCP Dup ACK 188#2] 54290 > https [ACK] Seq=1 Ack=425 Win=8207 Len=0 TSV=432366795 TSER=1171826312
  0.812550  10.8.103.68 -> 173.194.20.242 TCP [TCP Dup ACK 27#16] 55219 > http [ACK] Seq=1 Ack=1 Win=2132 Len=0 SLE=1453 SRE=26137
  0.818353  10.8.103.68 -> 173.194.20.242 TCP [TCP Dup ACK 27#17] 55219 > http [ACK] Seq=1 Ack=1 Win=2132 Len=0 SLE=1453 SRE=27589
  0.819736  10.8.103.68 -> 173.194.20.242 TCP [TCP Dup ACK 27#18] 55219 > http [ACK] Seq=1 Ack=1 Win=2132 Len=0 SLE=1453 SRE=29041
  0.820787  10.8.103.68 -> 173.194.20.242 TCP [TCP Dup ACK 27#19] 55219 > http [ACK] Seq=1 Ack=1 Win=2132 Len=0 SLE=1453 SRE=30493
  0.821783  10.8.103.68 -> 173.194.20.242 TCP [TCP Dup ACK 27#20] 55219 > http [ACK] Seq=1 Ack=1 Win=2132 Len=0 SLE=1453 SRE=31945
  0.822865  10.8.103.68 -> 173.194.20.242 TCP [TCP Dup ACK 27#21] 55219 > http [ACK] Seq=1 Ack=1 Win=2132 Len=0 SLE=1453 SRE=33397
  0.823501  10.8.103.68 -> 173.194.20.242 TCP [TCP Dup ACK 27#22] 55219 > http [ACK] Seq=1 Ack=1 Win=2132 Len=0 SLE=1453 SRE=34849
  0.824591  10.8.103.68 -> 173.194.20.242 TCP [TCP Dup ACK 27#23] 55219 > http [ACK] Seq=1 Ack=1 Win=2132 Len=0 SLE=1453 SRE=36301
  0.825594  10.8.103.68 -> 173.194.20.242 TCP [TCP Dup ACK 27#24] 55219 > http [ACK] Seq=1 Ack=1 Win=2132 Len=0 SLE=1453 SRE=37753
  0.826194  10.8.103.68 -> 173.194.20.242 TCP [TCP Dup ACK 27#25] 55219 > http [ACK] Seq=1 Ack=1 Win=2132 Len=0 SLE=1453 SRE=39205
  0.826793  10.8.103.68 -> 173.194.20.242 TCP [TCP Dup ACK 27#26] 55219 > http [ACK] Seq=1 Ack=1 Win=2132 Len=0 SLE=1453 SRE=40657
  0.827288 173.194.20.242 -> 10.8.103.68  HTTP Continuation or non-HTTP traffic
  0.828150 173.194.20.242 -> 10.8.103.68  HTTP Continuation or non-HTTP traffic
  0.828168 173.194.20.242 -> 10.8.103.68  HTTP Continuation or non-HTTP traffic
  0.830350  10.8.103.68 -> 173.194.20.242 TCP [TCP Dup ACK 27#27] 55219 > http [ACK] Seq=1 Ack=1 Win=2132 Len=0 SLE=1453 SRE=42109
  0.830984  10.8.103.68 -> 173.194.20.242 TCP [TCP Dup ACK 27#28] 55219 > http [ACK] Seq=1 Ack=1 Win=2132 Len=0 SLE=1453 SRE=43561
  0.831697  10.8.103.68 -> 173.194.20.242 TCP [TCP Dup ACK 27#29] 55219 > http [ACK] Seq=1 Ack=1 Win=2132 Len=0 SLE=1453 SRE=45013
  0.844314  10.8.103.68 -> 173.194.20.242 TCP [TCP Dup ACK 27#30] 55219 > http [ACK] Seq=1 Ack=1 Win=2132 Len=0 SLE=1453 SRE=46465
  0.844355 173.194.66.101 -> 10.8.103.68  TCP http > 55223 [SYN, ACK] Seq=0 Ack=0 Win=62920 Len=0 MSS=1430 WS=6
  0.850122  10.8.103.68 -> 173.194.20.242 TCP [TCP Dup ACK 27#31] 55219 > http [ACK] Seq=1 Ack=1 Win=2132 Len=0 SLE=1453 SRE=47917
  0.854430  10.8.103.68 -> 173.194.20.242 TCP [TCP Dup ACK 27#32] 55219 > http [ACK] Seq=1 Ack=1 Win=2132 Len=0 SLE=1453 SRE=49369
  0.855523  10.8.103.68 -> 173.194.20.242 TCP 55191 > http [ACK] Seq=1 Ack=1 Win=1196 Len=0 SLE=11617 SRE=14364
  0.856633  10.8.103.68 -> 173.194.20.242 TCP 55191 > http [ACK] Seq=1 Ack=1453 Win=1191 Len=0 SLE=11617 SRE=14364
  0.858290  10.8.110.95 -> 65.55.223.12 UDP Source port: 8483  Destination port: 40017
  0.858825  10.8.103.68 -> 173.194.20.242 TCP [TCP Dup ACK 69#23] 55218 > http [ACK] Seq=2484 Ack=23560 Win=1738 Len=0 SLE=1 SRE=328 SLE=93125 SRE=94577 SLE=87317 SRE=90221 SLE=82961 SRE=84413
  0.860416  10.8.103.68 -> 173.194.20.242 TCP 55191 > http [ACK] Seq=1 Ack=2905 Win=1185 Len=0 SLE=11617 SRE=14364
  0.862429  10.8.110.95 -> 157.55.235.159 UDP Source port: 8483  Destination port: 40006
  0.863253  10.8.110.95 -> 213.199.179.145 UDP Source port: 8483  Destination port: 40001
  0.865150  10.8.103.68 -> 173.194.20.242 TCP 55191 > http [ACK] Seq=1 Ack=4357 Win=1179 Len=0 SLE=11617 SRE=14364
  0.866195  10.8.103.68 -> 173.194.20.242 TCP [TCP Dup ACK 27#33] 55219 > http [ACK] Seq=1 Ack=1 Win=2132 Len=0 SLE=1453 SRE=50821
  0.874656  10.8.103.68 -> 173.194.20.242 TCP [TCP Dup ACK 27#34] 55219 > http [ACK] Seq=1 Ack=1 Win=2132 Len=0 SLE=1453 SRE=52273
  0.879004  10.8.103.68 -> 173.194.66.101 TCP [TCP segment of a reassembled PDU]
  0.880100  10.8.105.23 -> 10.8.111.255 NBNS Name query NB VOLTAIRE<20>
  0.884409 157.56.192.168 -> 10.8.110.95  TLSv1 Application Data
  0.885824 173.194.20.242 -> 10.8.103.68  HTTP Continuation or non-HTTP traffic
  0.886793 173.194.20.242 -> 10.8.103.68  HTTP Continuation or non-HTTP traffic
  0.888626 173.194.20.242 -> 10.8.103.68  HTTP Continuation or non-HTTP traffic
  0.888876 173.194.20.242 -> 10.8.103.68  HTTP Continuation or non-HTTP traffic
  0.889734 10.8.108.135 -> 157.56.52.19 TCP 58944 > 40017 [PSH, ACK] Seq=1 Ack=411 Win=60 Len=37
  0.895264 173.194.20.242 -> 10.8.103.68  HTTP Continuation or non-HTTP traffic
  0.908902  10.8.103.68 -> 173.194.66.101 HTTP GET /s?st=116.03500000000001&ctp=3&plid=AATfbiL9xXVHwWoy&ns=yt&asv=3&cpn=YFcQwfkmdaL7nEl4&vid=ZZzDPMbpqJzFBP8VFLcnv89QAfls6ywdU&fmt=134&docid=gSl7wZZFrqA&el=detailpage&yttk=1&et=116.03500000000001 HTTP/1.1 
  0.915371  10.8.103.68 -> 173.194.66.101 TCP 55223 > http [ACK] Seq=0 Ack=1 Win=64 Len=0
  0.916486  10.8.103.68 -> 173.194.66.101 TCP [TCP Dup ACK 231#1] 55211 > http [ACK] Seq=1729 Ack=413 Win=63 Len=0 SLE=1 SRE=413
  0.917358  10.8.103.68 -> 173.194.20.242 TCP 55224 > http [ACK] Seq=0 Ack=1 Win=64 Len=0
  0.920008  10.8.103.68 -> 173.194.20.242 TCP [TCP segment of a reassembled PDU]
  0.921118  10.8.103.68 -> 173.194.20.242 HTTP GET /videoplayback?source=youtube&mt=1371563984&mv=m&burst=40&factor=1.25&ms=au&upn=QXbmL46KPNk&gir=yes&algorithm=throttle-factor&ipbits=8&clen=45966654&expire=1371587755&signature=8B3B0B8FB084465645C133BD53AAB9704C0DD806.5EA0B00DAD2589D9DD9451021AF128AC4910071C&key=yt1&cp=U0hWRlVTVV9KT0NONl9NTVlIOm50UlI1ZXR5TE5w&id=81297bc19645aea0&newshard=yes&fexp=904000%2C916104%2C916624%2C919515%2C914004%2C900352%2C921047%2C924605%2C928201%2C901208%2C929117%2C929123%2C929121%2C929915%2C929906%2C929907%2C929125%2C925714%2C929919%2C931202%2C928017%2C912512%2C912515%2C912521%2C906906%2C904488%2C931910%2C931913%2C932227%2C904830%2C919373%2C933701%2C904122%2C932216%2C912711%2C930618%2C930621%2C929606%2C910075&sparams=algorithm%2Cburst%2Cclen%2Ccp%2Cfactor%2Cgir%2Cid%2Cip%2Cipbits%2Citag%2Clmt%2Csource%2Cupn%2Cexpire&itag=160&ip=79.82.49.58&lmt=1369895851630239&sver=3&range=0-93420 HTTP/1.1 
  0.922765  10.8.103.68 -> 173.194.66.101 TCP [TCP Dup ACK 232#1] 55223 > http [ACK] Seq=0 Ack=1 Win=64 Len=0 SLE=0 SRE=1
  0.923255  10.8.103.68 -> 173.194.20.242 TCP [TCP Dup ACK 236#1] 55224 > http [ACK] Seq=2425 Ack=1 Win=64 Len=0 SLE=0 SRE=1
  0.923842  10.8.103.68 -> 173.194.20.242 TCP [TCP Dup ACK 27#35] 55219 > http [ACK] Seq=1 Ack=1 Win=2132 Len=0 SLE=1453 SRE=53725
  0.924172 173.194.66.101 -> 10.8.103.68  TCP http > 55211 [ACK] Seq=413 Ack=1431 Win=1002 Len=0
  0.924369  10.8.103.68 -> 173.194.66.101 TCP [TCP Dup ACK 231#2] 55211 > http [ACK] Seq=1729 Ack=413 Win=63 Len=0 SLE=1 SRE=413
  0.926187  10.8.103.68 -> 173.194.20.242 TCP [TCP Dup ACK 27#36] 55219 > http [ACK] Seq=1 Ack=1 Win=2132 Len=0 SLE=1453 SRE=55177
  0.927249  10.8.103.68 -> 173.194.20.242 TCP 55219 > http [ACK] Seq=1 Ack=55177 Win=1917 Len=0
  0.927846  10.8.103.68 -> 173.194.20.242 TCP 55219 > http [ACK] Seq=1 Ack=58081 Win=1905 Len=0
  0.929074  10.8.109.65 -> 10.8.111.255 NBNS Name query NB ISATAP<00>
  0.930150  10.8.103.68 -> 10.8.111.255 UDP Source port: 17500  Destination port: 17500
  0.938385  10.8.110.38 -> 130.117.190.186 TCP 50570 > https [FIN, ACK] Seq=425 Ack=219 Win=4301 Len=0
  0.940385  10.8.103.68 -> 173.194.20.242 TCP [TCP Dup ACK 69#24] 55218 > http [ACK] Seq=2484 Ack=23560 Win=1738 Len=0 SLE=93125 SRE=96029 SLE=87317 SRE=90221 SLE=82961 SRE=84413 SLE=71345 SRE=78605
  0.943071  10.8.103.68 -> 173.194.20.242 TCP [TCP Dup ACK 69#25] 55218 > http [ACK] Seq=2484 Ack=23560 Win=1738 Len=0 SLE=93125 SRE=97481 SLE=87317 SRE=90221 SLE=82961 SRE=84413 SLE=71345 SRE=78605
  0.945612 173.194.66.101 -> 10.8.103.68  TCP http > 55211 [ACK] Seq=413 Ack=1729 Win=1002 Len=0
  0.946388 173.194.66.101 -> 10.8.103.68  HTTP HTTP/1.1 204 No Content 
  0.948435 108.160.163.45 -> 10.8.107.3   HTTP HTTP/1.1 200 OK  (text/plain)
  0.954710 IntelCor_b7:fe:46 -> HewlettP_3f:f2:82 ARP 10.8.102.145 is at 00:26:c7:b7:fe:46
  0.955198   10.8.98.38 -> 173.194.66.193 TCP 54291 > https [SYN] Seq=0 Win=65535 Len=0 MSS=1460 WS=4 TSV=432366898 TSER=0
  0.960386 173.194.20.242 -> 10.8.103.68  TCP http > 55224 [ACK] Seq=1 Ack=1452 Win=274 Len=0
  0.961725  10.8.103.68 -> 173.194.20.242 TCP [TCP Dup ACK 69#26] 55218 > http [ACK] Seq=2484 Ack=23560 Win=1738 Len=0 SLE=93125 SRE=98933 SLE=87317 SRE=90221 SLE=82961 SRE=84413 SLE=71345 SRE=78605
  0.962087  10.8.103.68 -> 173.194.20.242 TCP [TCP Dup ACK 69#27] 55218 > http [ACK] Seq=2484 Ack=23560 Win=1738 Len=0 SLE=93125 SRE=100385 SLE=87317 SRE=90221 SLE=82961 SRE=84413 SLE=71345 SRE=78605
  0.962839  10.8.103.68 -> 173.194.20.242 TCP [TCP Dup ACK 69#28] 55218 > http [ACK] Seq=2484 Ack=23560 Win=1738 Len=0 SLE=93125 SRE=101837 SLE=87317 SRE=90221 SLE=82961 SRE=84413 SLE=71345 SRE=78605
  0.966195  10.8.103.68 -> 173.194.20.242 TCP [TCP Dup ACK 69#29] 55218 > http [ACK] Seq=2484 Ack=23560 Win=1738 Len=0 SLE=93125 SRE=103289 SLE=87317 SRE=90221 SLE=82961 SRE=84413 SLE=71345 SRE=78605
  0.966364  10.8.103.68 -> 173.194.20.242 TCP 55218 > http [ACK] Seq=2484 Ack=25012 Win=1732 Len=0 SLE=93125 SRE=103289 SLE=87317 SRE=90221 SLE=82961 SRE=84413 SLE=71345 SRE=78605
  0.967649 173.194.20.242 -> 10.8.103.68  TCP http > 55224 [ACK] Seq=1 Ack=2425 Win=320 Len=0
  0.969422 10.8.105.245 -> 5.153.10.62  TCP 50111 > fmpro-internal [PSH, ACK] Seq=1 Ack=3103 Win=65535 Len=33 TSV=599360957 TSER=3952379088
  0.969553 65.55.223.12 -> 10.8.110.95  UDP Source port: 40017  Destination port: 8483
  0.969771  10.8.103.68 -> 173.194.20.242 TCP 55218 > http [ACK] Seq=2484 Ack=26464 Win=1726 Len=0 SLE=93125 SRE=103289 SLE=87317 SRE=90221 SLE=82961 SRE=84413 SLE=71345 SRE=78605
  0.976060 173.194.20.242 -> 10.8.103.68  HTTP [TCP Retransmission] Continuation or non-HTTP traffic
  0.976756 173.194.20.242 -> 10.8.103.68  HTTP Continuation or non-HTTP traffic
  0.977743 173.194.20.242 -> 10.8.103.68  HTTP [TCP Out-Of-Order] Continuation or non-HTTP traffic
  0.978722 173.194.20.242 -> 10.8.103.68  HTTP Continuation or non-HTTP traffic
  0.979152 157.55.235.159 -> 10.8.110.95  UDP Source port: 40006  Destination port: 8483
  0.983113 130.117.190.186 -> 10.8.110.38  TCP https > 50570 [ACK] Seq=219 Ack=426 Win=8349 Len=0
  0.983272 130.117.190.186 -> 10.8.110.38  TCP https > 50570 [FIN, ACK] Seq=219 Ack=426 Win=8349 Len=0
  0.991163 173.194.66.193 -> 10.8.98.38   TCP https > 54291 [SYN, ACK] Seq=0 Ack=1 Win=62392 Len=0 MSS=1430 TSV=1151522731 TSER=432366898 WS=6
  0.992770 173.194.20.242 -> 10.8.103.68  HTTP Continuation or non-HTTP traffic
  0.993753 173.194.20.242 -> 10.8.103.68  HTTP Continuation or non-HTTP traffic
  0.994704 173.194.20.242 -> 10.8.103.68  HTTP Continuation or non-HTTP traffic
  0.994885  5.153.10.62 -> 10.8.105.245 TCP fmpro-internal > 50111 [PSH, ACK] Seq=3103 Ack=1 Win=5792 Len=91 TSV=3952379459 TSER=599360620
  0.995544 10.8.105.245 -> 5.153.10.62  TCP 50111 > fmpro-internal [ACK] Seq=34 Ack=3194 Win=65535 Len=0 TSV=599360986 TSER=3952379459
  0.996740   10.8.98.38 -> 173.194.66.193 TCP 54291 > https [ACK] Seq=1 Ack=1 Win=131872 Len=0 TSV=432366977 TSER=1151522731
  0.997193 173.194.20.242 -> 10.8.103.68  HTTP Continuation or non-HTTP traffic
  0.998192  5.153.10.62 -> 10.8.105.245 TCP fmpro-internal > 50111 [PSH, ACK] Seq=3194 Ack=1 Win=5792 Len=107 TSV=3952379462 TSER=599360620
  0.998197 173.194.20.242 -> 10.8.103.68  HTTP Continuation or non-HTTP traffic
  0.998883 10.8.105.245 -> 5.153.10.62  TCP 50111 > fmpro-internal [ACK] Seq=34 Ack=3301 Win=65535 Len=0 TSV=599360989 TSER=3952379462
  0.999557   10.8.98.38 -> 173.194.66.193 SSL Client Hello
  1.000375 173.194.20.242 -> 10.8.103.68  HTTP Continuation or non-HTTP traffic
  1.000632  10.8.103.68 -> 173.194.20.242 TCP 55218 > http [ACK] Seq=2484 Ack=27916 Win=1721 Len=0 SLE=93125 SRE=103289 SLE=87317 SRE=90221 SLE=82961 SRE=84413 SLE=71345 SRE=78605
  1.001056  10.8.103.68 -> 173.194.20.242 TCP 55218 > http [ACK] Seq=2484 Ack=29368 Win=1715 Len=0 SLE=93125 SRE=103289 SLE=87317 SRE=90221 SLE=82961 SRE=84413 SLE=71345 SRE=78605
  1.001339  10.8.103.68 -> 173.194.20.242 TCP 55218 > http [ACK] Seq=2484 Ack=30820 Win=1803 Len=0 SLE=93125 SRE=103289 SLE=87317 SRE=90221 SLE=82961 SRE=84413 SLE=71345 SRE=78605
  1.004700  10.8.103.68 -> 173.194.20.242 TCP 55218 > http [ACK] Seq=2484 Ack=33724 Win=1803 Len=0 SLE=93125 SRE=103289 SLE=87317 SRE=90221 SLE=82961 SRE=84413 SLE=71345 SRE=78605
  1.007833  10.8.103.68 -> 173.194.20.242 TCP 55218 > http [ACK] Seq=2484 Ack=35176 Win=1803 Len=0 SLE=93125 SRE=103289 SLE=87317 SRE=90221 SLE=82961 SRE=84413 SLE=71345 SRE=78605
  1.008009 173.194.20.242 -> 10.8.103.68  TCP [TCP segment of a reassembled PDU]
  1.009266 173.194.20.242 -> 10.8.103.68  TCP [TCP segment of a reassembled PDU]
  1.010055 173.194.20.242 -> 10.8.103.68  TCP [TCP segment of a reassembled PDU]
  1.011228 173.194.20.242 -> 10.8.103.68  TCP [TCP segment of a reassembled PDU]
  1.012203 173.194.20.242 -> 10.8.103.68  TCP [TCP segment of a reassembled PDU]
  1.012339  10.8.103.68 -> 173.194.20.242 TCP 55218 > http [ACK] Seq=2484 Ack=39532 Win=1803 Len=0 SLE=93125 SRE=103289 SLE=87317 SRE=90221 SLE=82961 SRE=84413 SLE=71345 SRE=78605
  1.012775  10.8.103.68 -> 173.194.20.242 TCP 55218 > http [ACK] Seq=2484 Ack=42436 Win=1803 Len=0 SLE=93125 SRE=103289 SLE=87317 SRE=90221 SLE=82961 SRE=84413 SLE=71345 SRE=78605
  1.013493  10.8.103.68 -> 173.194.20.242 TCP 55218 > http [ACK] Seq=2484 Ack=49696 Win=1786 Len=0 SLE=93125 SRE=103289 SLE=87317 SRE=90221 SLE=82961 SRE=84413 SLE=71345 SRE=78605
  1.013984 173.194.20.242 -> 10.8.103.68  TCP [TCP segment of a reassembled PDU]
  1.014666 173.194.20.242 -> 10.8.103.68  TCP [TCP segment of a reassembled PDU]
  1.014933  10.8.103.68 -> 173.194.20.242 TCP 55218 > http [ACK] Seq=2484 Ack=51148 Win=1786 Len=0 SLE=93125 SRE=103289 SLE=87317 SRE=90221 SLE=82961 SRE=84413 SLE=71345 SRE=78605
  1.014937  10.8.103.68 -> 173.194.20.242 TCP 55218 > http [ACK] Seq=2484 Ack=52600 Win=1786 Len=0 SLE=93125 SRE=103289 SLE=87317 SRE=90221 SLE=82961 SRE=84413 SLE=71345 SRE=78605
  1.014941 173.194.20.242 -> 10.8.103.68  TCP [TCP segment of a reassembled PDU]
  1.015730  10.8.103.68 -> 173.194.20.242 TCP 55218 > http [ACK] Seq=2484 Ack=54052 Win=1786 Len=0 SLE=93125 SRE=103289 SLE=87317 SRE=90221 SLE=82961 SRE=84413 SLE=71345 SRE=78605
  1.016283  5.153.10.62 -> 10.8.105.245 TCP fmpro-internal > 50111 [ACK] Seq=3301 Ack=34 Win=5792 Len=0 TSV=3952379478 TSER=599360957
  1.016288 173.194.20.242 -> 10.8.103.68  TCP [TCP segment of a reassembled PDU]
  1.016416  10.8.103.68 -> 173.194.20.242 TCP 55218 > http [ACK] Seq=2484 Ack=55504 Win=1786 Len=0 SLE=93125 SRE=103289 SLE=87317 SRE=90221 SLE=82961 SRE=84413 SLE=71345 SRE=78605
  1.017098  10.8.103.68 -> 173.194.20.242 TCP 55218 > http [ACK] Seq=2484 Ack=56956 Win=1786 Len=0 SLE=93125 SRE=103289 SLE=87317 SRE=90221 SLE=82961 SRE=84413 SLE=71345 SRE=78605
  1.017848  10.8.103.68 -> 173.194.20.242 TCP 55218 > http [ACK] Seq=2484 Ack=58408 Win=1786 Len=0 SLE=93125 SRE=103289 SLE=87317 SRE=90221 SLE=82961 SRE=84413 SLE=71345 SRE=78605
  1.018800  5.153.10.62 -> 10.8.105.245 TCP fmpro-internal > 50111 [PSH, ACK] Seq=3301 Ack=34 Win=5792 Len=67 TSV=3952379483 TSER=599360957
  1.022655  10.8.103.68 -> 173.194.20.242 TCP 55218 > http [ACK] Seq=2484 Ack=59860 Win=1786 Len=0 SLE=93125 SRE=103289 SLE=87317 SRE=90221 SLE=82961 SRE=84413 SLE=71345 SRE=78605
  1.024737   10.8.97.92 -> 149.62.158.51 TCP 62215 > https [SYN] Seq=0 Win=8192 Len=0 MSS=1460 WS=8
  1.025449 10.8.105.245 -> 5.153.10.62  TCP 50111 > fmpro-internal [ACK] Seq=34 Ack=3368 Win=65535 Len=0 TSV=599361015 TSER=3952379483
  1.028462  10.8.103.68 -> 173.194.20.242 TCP 55218 > http [ACK] Seq=2484 Ack=68441 Win=1786 Len=0 SLE=93125 SRE=103289 SLE=87317 SRE=90221 SLE=82961 SRE=84413 SLE=71345 SRE=78605
  1.029797  10.8.103.68 -> 173.194.20.242 TCP [TCP Dup ACK 313#1] 55218 > http [ACK] Seq=2484 Ack=68441 Win=1786 Len=0 SLE=93125 SRE=104741 SLE=87317 SRE=90221 SLE=82961 SRE=84413 SLE=71345 SRE=78605
  1.030551  10.8.103.68 -> 173.194.20.242 TCP [TCP Dup ACK 313#2] 55218 > http [ACK] Seq=2484 Ack=68441 Win=1786 Len=0 SLE=93125 SRE=106193 SLE=87317 SRE=90221 SLE=82961 SRE=84413 SLE=71345 SRE=78605
  1.033106  10.8.103.68 -> 173.194.20.242 TCP [TCP Dup ACK 313#3] 55218 > http [ACK] Seq=2484 Ack=68441 Win=1786 Len=0 SLE=93125 SRE=107645 SLE=87317 SRE=90221 SLE=82961 SRE=84413 SLE=71345 SRE=78605
  1.033644  10.8.103.68 -> 173.194.20.242 TCP 55218 > http [ACK] Seq=2484 Ack=69893 Win=1780 Len=0 SLE=93125 SRE=107645 SLE=87317 SRE=90221 SLE=82961 SRE=84413 SLE=71345 SRE=78605
  1.034791  10.8.103.68 -> 173.194.20.242 TCP [TCP Dup ACK 317#1] 55218 > http [ACK] Seq=2484 Ack=69893 Win=1780 Len=0 SLE=93125 SRE=109097 SLE=87317 SRE=90221 SLE=82961 SRE=84413 SLE=71345 SRE=78605
  1.035293  10.8.103.68 -> 173.194.20.242 TCP 55218 > http [ACK] Seq=2484 Ack=78605 Win=1775 Len=0 SLE=93125 SRE=109097 SLE=87317 SRE=90221 SLE=82961 SRE=84413
  1.035453  10.8.103.68 -> 173.194.20.242 TCP [TCP Dup ACK 319#1] 55218 > http [ACK] Seq=2484 Ack=78605 Win=1775 Len=0 SLE=93125 SRE=110549 SLE=87317 SRE=90221 SLE=82961 SRE=84413
  1.036517 173.194.66.193 -> 10.8.98.38   TCP https > 54291 [ACK] Seq=1 Ack=226 Win=63488 Len=0 TSV=1151522777 TSER=432366981
  1.037319 173.194.66.193 -> 10.8.98.38   TLSv1.2 Server Hello, Change Cipher Spec, Encrypted Handshake Message
  1.038274 173.194.20.242 -> 10.8.103.68  HTTP Continuation or non-HTTP traffic
  1.038769  10.8.103.68 -> 173.194.20.242 TCP [TCP Dup ACK 319#2] 55218 > http [ACK] Seq=2484 Ack=78605 Win=1775 Len=0 SLE=93125 SRE=112001 SLE=87317 SRE=90221 SLE=82961 SRE=84413
  1.038938  10.8.103.68 -> 173.194.20.242 TCP [TCP Dup ACK 319#3] 55218 > http [ACK] Seq=2484 Ack=78605 Win=1775 Len=0 SLE=93125 SRE=113453 SLE=87317 SRE=90221 SLE=82961 SRE=84413
  1.039016   10.8.98.38 -> 173.194.66.193 TCP 54291 > https [ACK] Seq=226 Ack=134 Win=131728 Len=0 TSV=432367018 TSER=1151522777
  1.039363 173.194.20.242 -> 10.8.103.68  HTTP Continuation or non-HTTP traffic
  1.039866  10.8.103.68 -> 173.194.20.242 TCP 55225 > http [SYN] Seq=0 Win=8192 Len=0 MSS=1460 WS=8
  1.040306  5.153.10.62 -> 10.8.105.245 TCP fmpro-internal > 50111 [PSH, ACK] Seq=3368 Ack=34 Win=5792 Len=280 TSV=3952379504 TSER=599360986
  1.040432  10.8.103.68 -> 173.194.20.242 TCP [TCP Dup ACK 319#4] 55218 > http [ACK] Seq=2484 Ack=78605 Win=1775 Len=0 SLE=93125 SRE=114905 SLE=87317 SRE=90221 SLE=82961 SRE=84413
  1.040496   10.8.98.38 -> 173.194.66.193 TLSv1.2 Change Cipher Spec
  1.041242 10.8.105.245 -> 5.153.10.62  TCP 50111 > fmpro-internal [PSH, ACK] Seq=34 Ack=3368 Win=65535 Len=26 TSV=599361030 TSER=3952379483
  1.041635 10.8.105.245 -> 5.153.10.62  TCP 50111 > fmpro-internal [ACK] Seq=60 Ack=3648 Win=65535 Len=0 TSV=599361030 TSER=3952379504
  1.041640  10.8.103.68 -> 173.194.20.242 TCP 55218 > http [ACK] Seq=2484 Ack=80057 Win=1769 Len=0 SLE=93125 SRE=114905 SLE=87317 SRE=90221 SLE=82961 SRE=84413
  1.041900  10.8.103.68 -> 173.194.20.242 TCP [TCP Dup ACK 334#1] 55218 > http [ACK] Seq=2484 Ack=80057 Win=1769 Len=0 SLE=93125 SRE=116357 SLE=87317 SRE=90221 SLE=82961 SRE=84413
